,tweet_id,timestamp,text,dog_name,retweet_count,favorite_count,jpg_url,img_num,first_pred_group,first_pred_conf,is_first_pred_dog,second_pred_group,second_pred_conf,is_second_pred_dog,third_pred_group,third_pred_conf,is_third_pred_dog,dog_stage,final_rating
0,892420643555336193,2017-08-01 16:23:56+00:00,This is Phineas. He's a mystical boy. Only ever appears in the hole of a donut. 13/10 https://t.co/MgUWQ76dJU,Phineas,7481,35426,https://pbs.twimg.com/media/DGKD1-bXoAAIAUK.jpg,1,orange,0.0970486,0,bagel,0.08585110000000001,0,banana,0.07611,0,,1.3
1,892177421306343426,2017-08-01 00:17:27+00:00,"This is Tilly. She's just checking pup on you. Hopes you're doing ok. If not, she's available for pats, snugs, boops, the whole bit. 13/10 https://t.co/0Xxu71qeIV",Tilly,5551,30648,https://pbs.twimg.com/media/DGGmoV4XsAAUL6n.jpg,1,chihuahua,0.323581,1,pekinese,0.0906465,1,papillon,0.0689569,1,,1.3
2,891815181378084864,2017-07-31 00:18:03+00:00,This is Archie. He is a rare Norwegian Pouncing Corgo. Lives in the tall grass. You never know when one may strike. 12/10 https://t.co/wUnZnhtVJB,Archie,3675,23057,https://pbs.twimg.com/media/DGBdLU1WsAANxJ9.jpg,1,chihuahua,0.716012,1,malamute,0.078253,1,kelpie,0.0313789,1,,1.2
3,891689557279858688,2017-07-30 15:58:51+00:00,This is Darla. She commenced a snooze mid meal. 13/10 happens to the best of us https://t.co/tD36da7qLQ,Darla,7648,38700,https://pbs.twimg.com/media/DF_q7IAWsAEuuN8.jpg,1,paper_towel,0.17027799999999998,0,labrador_retriever,0.168086,1,spatula,0.0408359,0,,1.3
4,891327558926688256,2017-07-29 16:00:24+00:00,"This is Franklin. He would like you to stop calling him ""cute."" He is a very fierce shark and should be respected as such. 12/10 #BarkWeek https://t.co/AtUZn91f7f",Franklin,8259,36952,https://pbs.twimg.com/media/DF6hr6BUMAAzZgT.jpg,2,basset,0.555712,1,english_springer,0.22577,1,german_short_haired_pointer,0.175219,1,,1.2
5,891087950875897856,2017-07-29 00:08:17+00:00,Here we have a majestic great white breaching off South Africa's coast. Absolutely h*ckin breathtaking. 13/10 (IG: tucker_marlo) #BarkWeek https://t.co/kQ04fDDRmh,,2762,18622,https://pbs.twimg.com/media/DF3HwyEWsAABqE6.jpg,1,chesapeake_bay_retriever,0.425595,1,irish_terrier,0.116317,1,indian_elephant,0.07690219999999999,0,,1.3
6,890971913173991426,2017-07-28 16:27:12+00:00,"Meet Jax. He enjoys ice cream so much he gets nervous around it. 13/10 help Jax enjoy more things by clicking below

https://t.co/Zr4hWfAs1H https://t.co/tVJBRMnhxl",Jax,1794,10825,https://pbs.twimg.com/media/DF1eOmZXUAALUcq.jpg,1,appenzeller,0.34170300000000003,1,border_collie,0.199287,1,ice_lolly,0.193548,0,,1.3
7,890729181411237888,2017-07-28 00:22:40+00:00,When you watch your owner call another dog a good boy but then they turn back to you and say you're a great boy. 13/10 https://t.co/v0nONBcwxq,,16747,59660,https://pbs.twimg.com/media/DFyBahAVwAAhUTd.jpg,2,pomeranian,0.566142,1,eskimo_dog,0.17840599999999998,1,pembroke,0.0765069,1,,1.3
8,890609185150312448,2017-07-27 16:25:51+00:00,This is Zoey. She doesn't want to be one of the scary sharks. Just wants to be a snuggly pettable boatpet. 13/10 #BarkWeek https://t.co/9TwLuAGH0b,Zoey,3819,25658,https://pbs.twimg.com/media/DFwUU__XcAEpyXI.jpg,1,irish_terrier,0.487574,1,irish_setter,0.193054,1,chesapeake_bay_retriever,0.118184,1,,1.3
9,890240255349198849,2017-07-26 15:59:51+00:00,This is Cassie. She is a college pup. Studying international doggo communication and stick theory. 14/10 so elegant much sophisticate https://t.co/t1bfwz5S2A,Cassie,6501,29277,https://pbs.twimg.com/media/DFrEyVuW0AAO3t9.jpg,1,pembroke,0.511319,1,cardigan,0.451038,1,chihuahua,0.0292482,1,doggo,1.4
10,890006608113172480,2017-07-26 00:31:25+00:00,This is Koda. He is a South Australian deckshark. Deceptively deadly. Frighteningly majestic. 13/10 would risk a petting #BarkWeek https://t.co/dVPW0B0Mme,Koda,6507,28222,https://pbs.twimg.com/media/DFnwSY4WAAAMliS.jpg,1,samoyed,0.957979,1,pomeranian,0.0138835,1,chow,0.00816748,1,,1.3
11,889880896479866881,2017-07-25 16:11:53+00:00,This is Bruno. He is a service shark. Only gets out of the water to assist you. 13/10 terrifyingly good boy https://t.co/u1XPQMl29g,Bruno,4418,25676,https://pbs.twimg.com/media/DFl99B1WsAITKsg.jpg,1,french_bulldog,0.377417,1,labrador_retriever,0.151317,1,muzzle,0.0829811,0,,1.3
12,889665388333682689,2017-07-25 01:55:32+00:00,Here's a puppo that seems to be on the fence about something haha no but seriously someone help her. 13/10 https://t.co/BxvuXk0UCm,,8868,44120,https://pbs.twimg.com/media/DFi579UWsAAatzw.jpg,1,pembroke,0.966327,1,cardigan,0.0273557,1,basenji,0.00463323,1,puppo,1.3
13,889638837579907072,2017-07-25 00:10:02+00:00,This is Ted. He does his best. Sometimes that's not enough. But it's ok. 12/10 would assist https://t.co/f8dEDcrKSR,Ted,3971,24814,https://pbs.twimg.com/media/DFihzFfXsAYGDPR.jpg,1,french_bulldog,0.99165,1,boxer,0.00212864,1,staffordshire_bullterrier,0.00149818,1,,1.2
14,889531135344209921,2017-07-24 17:02:04+00:00,This is Stuart. He's sporting his favorite fanny pack. Secretly filled with bones only. 13/10 puppared puppo #BarkWeek https://t.co/y70o6h3isq,Stuart,2004,13958,https://pbs.twimg.com/media/DFg_2PVW0AEHN3p.jpg,1,golden_retriever,0.953442,1,labrador_retriever,0.0138341,1,redbone,0.00795775,1,puppo,1.3
15,889278841981685760,2017-07-24 00:19:32+00:00,This is Oliver. You're witnessing one of his many brutal attacks. Seems to be playing with his victim. 13/10 fr*ckin frightening #BarkWeek https://t.co/WpHvrQedPb,Oliver,4726,23148,https://pbs.twimg.com/ext_tw_video_thumb/889278779352338437/pu/img/VlbFB3v8H8VwzVNY.jpg,1,whippet,0.626152,1,borzoi,0.194742,1,saluki,0.0273507,1,,1.3
16,888917238123831296,2017-07-23 00:22:39+00:00,This is Jim. He found a fren. Taught him how to sit like the good boys. 12/10 for both https://t.co/chxruIOUJN,Jim,3976,26757,https://pbs.twimg.com/media/DFYRgsOUQAARGhO.jpg,1,golden_retriever,0.714719,1,tibetan_mastiff,0.120184,1,labrador_retriever,0.105506,1,,1.2
17,888804989199671297,2017-07-22 16:56:37+00:00,This is Zeke. He has a new stick. Very proud of it. Would like you to throw it for him without taking it. 13/10 would do my best https://t.co/HTQ77yNQ5K,Zeke,3751,23488,https://pbs.twimg.com/media/DFWra-3VYAA2piG.jpg,1,golden_retriever,0.46976,1,labrador_retriever,0.184172,1,english_setter,0.0734817,1,,1.3
18,888554962724278272,2017-07-22 00:23:06+00:00,This is Ralphus. He's powering up. Attempting maximum borkdrive. 13/10 inspirational af https://t.co/YnYAFCTTiK,Ralphus,3068,18110,https://pbs.twimg.com/media/DFTH_O-UQAACu20.jpg,3,siberian_husky,0.700377,1,eskimo_dog,0.166511,1,malamute,0.111411,1,,1.3
19,888078434458587136,2017-07-20 16:49:33+00:00,This is Gerald. He was just told he didn't get the job he interviewed for. A h*ckin injustice. 12/10 didn't want the job anyway https://t.co/DK7iDPfuRX,Gerald,3075,20020,https://pbs.twimg.com/media/DFMWn56WsAAkA7B.jpg,1,french_bulldog,0.995026,1,pug,0.000931908,1,bull_mastiff,0.000903211,1,,1.2
20,887705289381826560,2017-07-19 16:06:48+00:00,This is Jeffrey. He has a monopoly on the pool noodles. Currently running a 'boop for two' midweek sale. 13/10 h*ckin strategic https://t.co/PhrUk20Q64,Jeffrey,4790,27834,https://pbs.twimg.com/media/DFHDQBbXgAEqY7t.jpg,1,basset,0.821664,1,redbone,0.0875815,1,weimaraner,0.026236400000000003,1,,1.3
21,887517139158093824,2017-07-19 03:39:09+00:00,I've yet to rate a Venezuelan Hover Wiener. This is such an honor. 14/10 paw-inspiring af (IG: roxy.thedoxy) https://t.co/20VrLAA8ba,,10454,42607,https://pbs.twimg.com/ext_tw_video_thumb/887517108413886465/pu/img/WanJKwssZj4VJvL9.jpg,1,limousine,0.130432,0,tow_truck,0.0291754,0,shopping_cart,0.0263208,0,,1.4
22,887473957103951883,2017-07-19 00:47:34+00:00,This is Canela. She attempted some fancy porch pics. They were unsuccessful. 13/10 someone help her https://t.co/cLyzpcUcMX,Canela,15950,63104,https://pbs.twimg.com/media/DFDw2tyUQAAAFke.jpg,2,pembroke,0.809197,1,rhodesian_ridgeback,0.05495,1,beagle,0.0389148,1,,1.3
23,887343217045368832,2017-07-18 16:08:03+00:00,You may not have known you needed to see this today. 13/10 please enjoy (IG: emmylouroo) https://t.co/WZqNqygEyV,,9341,30939,https://pbs.twimg.com/ext_tw_video_thumb/887343120832229379/pu/img/6HSuFrW1lzI_9Mht.jpg,1,mexican_hairless,0.330741,1,sea_lion,0.275645,0,weimaraner,0.134203,1,,1.3
24,887101392804085760,2017-07-18 00:07:08+00:00,This... is a Jubilant Antarctic House Bear. We only rate dogs. Please only send dogs. Thank you... 12/10 would suffocate in floof https://t.co/4Ad1jzJSdp,,5290,28159,https://pbs.twimg.com/media/DE-eAq6UwAA-jaE.jpg,1,samoyed,0.733942,1,eskimo_dog,0.0350295,1,staffordshire_bullterrier,0.029704700000000007,1,,1.2
25,886983233522544640,2017-07-17 16:17:36+00:00,This is Maya. She's very shy. Rarely leaves her cup. 13/10 would find her an environment to thrive in https://t.co/I6oNy0CgiT,Maya,6785,31997,https://pbs.twimg.com/media/DE8yicJW0AAAvBJ.jpg,2,chihuahua,0.793469,1,toy_terrier,0.143528,1,can_opener,0.0322529,0,,1.3
26,886736880519319552,2017-07-16 23:58:41+00:00,"This is Mingus. He's a wonderful father to his smol pup. Confirmed 13/10, but he needs your help

https://t.co/bVi0Yr4Cff https://t.co/ISvKOSkd5b",Mingus,2829,10988,https://pbs.twimg.com/media/DE5Se8FXcAAJFx4.jpg,1,kuvasz,0.309706,1,great_pyrenees,0.186136,1,dandie_dinmont,0.08634630000000001,1,,1.3
27,886680336477933568,2017-07-16 20:14:00+00:00,This is Derek. He's late for a dog meeting. 13/10 pet...al to the metal https://t.co/BCoWue0abA,Derek,3975,20672,https://pbs.twimg.com/media/DE4fEDzWAAAyHMM.jpg,1,convertible,0.738995,0,sports_car,0.139952,0,car_wheel,0.0441727,0,,1.3
28,886366144734445568,2017-07-15 23:25:31+00:00,This is Roscoe. Another pupper fallen victim to spontaneous tongue ejections. Get the BlepiPen immediate. 12/10 deep breaths Roscoe https://t.co/RGE08MIJox,Roscoe,2807,19419,https://pbs.twimg.com/media/DE0BTnQUwAApKEH.jpg,1,french_bulldog,0.999201,1,chihuahua,0.000361178,1,boston_bull,7.55616e-05,1,pupper,1.2
30,886258384151887873,2017-07-15 16:17:19+00:00,This is Waffles. His doggles are pupside down. Unsure how to fix. 13/10 someone assist Waffles https://t.co/xZDA9Qsq1O,Waffles,5613,25701,https://pbs.twimg.com/media/DEyfTG4UMAE4aE9.jpg,1,pug,0.943575,1,shower_cap,0.0252856,0,siamese_cat,0.00284892,0,,1.3
32,885984800019947520,2017-07-14 22:10:11+00:00,Viewer discretion advised. This is Jimbo. He will rip ur finger right h*ckin off. Other dog clearly an accessory. 12/10 pls pet with caution https://t.co/BuveP0uMF1,Jimbo,5956,29935,https://pbs.twimg.com/media/DEumeWWV0AA-Z61.jpg,1,blenheim_spaniel,0.972494,1,shih_tzu,0.00663012,1,bernese_mountain_dog,0.00623915,1,,1.2
33,885528943205470208,2017-07-13 15:58:47+00:00,This is Maisey. She fell asleep mid-excavation. Happens to the best of us. 13/10 would pat noggin approvingly https://t.co/tp1kQ8i9JF,Maisey,5670,33041,https://pbs.twimg.com/media/DEoH3yvXgAAzQtS.jpg,1,pug,0.369275,1,labrador_retriever,0.265835,1,kuvasz,0.134697,1,,1.3
36,885167619883638784,2017-07-12 16:03:00+00:00,Here we have a corgi undercover as a malamute. Pawbably doing important investigative work. Zero control over tongue happenings. 13/10 https://t.co/44ItaMubBf,,3874,20101,https://pbs.twimg.com/media/DEi_N9qXYAAgEEw.jpg,4,malamute,0.8124819999999999,1,siberian_husky,0.0717125,1,eskimo_dog,0.0557697,1,,1.3
37,884925521741709313,2017-07-12 00:01:00+00:00,"This is Earl. He found a hat. Nervous about what you think of it. 12/10 it's delightful, Earl https://t.co/MYJvdlNRVa",Earl,16003,70659,https://pbs.twimg.com/media/DEfjEaNXkAAtPlj.jpg,1,italian_greyhound,0.259916,1,american_staffordshire_terrier,0.198451,1,staffordshire_bullterrier,0.127725,1,,1.2
38,884876753390489601,2017-07-11 20:47:12+00:00,This is Lola. It's her first time outside. Must test the earth and taste the atmosphere. 13/10 you're doing great Lola https://t.co/74TKAUsLkO,Lola,4950,25555,https://pbs.twimg.com/media/DEe2tZXXkAAwyX3.jpg,1,chow,0.822103,1,norwich_terrier,0.106075,1,norfolk_terrier,0.0373485,1,,1.3
39,884562892145688576,2017-07-11 00:00:02+00:00,This is Kevin. He's just so happy. 13/10 what is your secret Kevin https://t.co/1r4MFCbCX5,Kevin,4173,22337,https://pbs.twimg.com/media/DEaZQkfXUAEC7qB.jpg,1,pug,0.5464060000000001,1,french_bulldog,0.404291,1,brabancon_griffon,0.0440019,1,,1.3
40,884441805382717440,2017-07-10 15:58:53+00:00,"I present to you, Pup in Hat. Pup in Hat is great for all occasions. Extremely versatile. Compact as h*ck. 14/10 (IG: itselizabethgales) https://t.co/vvBOcC2VdC",,5061,24914,https://pbs.twimg.com/media/DEYrIZwWsAA2Wo5.jpg,1,pembroke,0.993225,1,cardigan,0.00321648,1,chihuahua,0.00208089,1,,1.4
42,884162670584377345,2017-07-09 21:29:42+00:00,Meet Yogi. He doesn't have any important dog meetings today he just enjoys looking his best at all times. 12/10 for dangerously dapper doggo https://t.co/YSI00BzTBZ,Yogi,2655,18765,https://pbs.twimg.com/media/DEUtQbzW0AUTv_o.jpg,1,german_shepherd,0.707046,1,malinois,0.199396,1,norwegian_elkhound,0.0491476,1,doggo,1.2
43,883838122936631299,2017-07-09 00:00:04+00:00,This is Noah. He can't believe someone made this mess. Got the vacuum out for you though. Offered to help clean pup. 12/10 super good boy https://t.co/V85xujjDDY,Noah,3030,20068,https://pbs.twimg.com/media/DEQGFgAXUAAEvfi.jpg,1,doberman,0.610946,1,miniature_pinscher,0.299603,1,kelpie,0.0630203,1,,1.2
44,883482846933004288,2017-07-08 00:28:19+00:00,"This is Bella. She hopes her smile made you smile. If not, she is also offering you her favorite monkey. 13.5/10 https://t.co/qjrljjt948",Bella,8764,42110,https://pbs.twimg.com/media/DELC9dZXUAADqUk.jpg,1,golden_retriever,0.943082,1,labrador_retriever,0.032409,1,kuvasz,0.00550072,1,,0.5
45,883360690899218434,2017-07-07 16:22:55+00:00,Meet Grizzwald. He may be the floofiest floofer I ever did see. Lost eyes saving a schoolbus from a volcano erpuption. 13/10 heroic as h*ck https://t.co/rf661IFEYP,Grizzwald,3273,20851,https://pbs.twimg.com/media/DEJT3FeXoAAtwUy.jpg,1,chow,0.987997,1,tibetan_mastiff,0.00709872,1,newfoundland,0.00214033,1,floofer,1.3
46,883117836046086144,2017-07-07 00:17:54+00:00,"Please only send dogs. We don't rate mechanics, no matter how h*ckin good. Thank you... 13/10 would sneak a pat https://t.co/Se5fZ9wp5E",,5893,34079,https://pbs.twimg.com/media/DEF2-_hXoAAs62q.jpg,2,golden_retriever,0.949562,1,labrador_retriever,0.045947900000000014,1,kuvasz,0.00247094,1,,1.3
47,882992080364220416,2017-07-06 15:58:11+00:00,This is Rusty. He wasn't ready for the first pic. Clearly puppared for the second. 13/10 confirmed great boy https://t.co/tyER0KpdXj,Rusty,3446,21953,https://pbs.twimg.com/media/DEEEnIqXYAAiJh_.jpg,1,eskimo_dog,0.466778,1,siberian_husky,0.406044,1,dingo,0.07341439999999999,0,,1.3
48,882762694511734784,2017-07-06 00:46:41+00:00,This is Gus. He's quite the cheeky pupper. Already perfected the disinterested wink. 12/10 would let steal my girl https://t.co/D43I96SlVu,Gus,4330,25955,https://pbs.twimg.com/media/DEAz_HHXsAA-p_z.jpg,1,labrador_retriever,0.85005,1,chesapeake_bay_retriever,0.074257,1,flat_coated_retriever,0.015579399999999997,1,pupper,1.2
49,882627270321602560,2017-07-05 15:48:34+00:00,This is Stanley. He has his first swim lesson today. Doggle straps adjusted. Ready to go. 13/10 Phelps is nervous (IG: stanleythe_corgi) https://t.co/Nx52PGwH94,Stanley,5384,25756,https://pbs.twimg.com/media/DD-40X3WAAAJPU5.jpg,1,pembroke,0.542982,1,chihuahua,0.251988,1,cardigan,0.107699,1,,1.3
50,882268110199369728,2017-07-04 16:01:23+00:00,This is Alfy. You're witnessing his first watermelon experience. I think it was a success. 13/10 happy 4th Alfy ðŸ‡ºðŸ‡¸ https://t.co/fYP5RlutfA,Alfy,10290,41186,https://pbs.twimg.com/media/DD5yKdPW0AArzX8.jpg,1,golden_retriever,0.762211,1,labrador_retriever,0.0989849,1,cocker_spaniel,0.0171995,1,,1.3
51,882045870035918850,2017-07-04 01:18:17+00:00,"This is Koko. Her owner, inspired by Barney, recently built a cart for her to use during walks if she got tired. 13/10 rest easy Koko https://t.co/zeDpnsKX7w",Koko,4320,26947,https://pbs.twimg.com/media/DD2oCl2WAAEI_4a.jpg,1,web_site,0.949591,0,dhole,0.0173258,0,golden_retriever,0.00694063,1,,1.3
52,881906580714921986,2017-07-03 16:04:48+00:00,This is Rey. He's a Benebop Cumberfloof. 12/10 dangerously pettable https://t.co/503CgWbhxQ,Rey,3021,22400,https://pbs.twimg.com/media/DD0pWm9XcAAeSBL.jpg,1,weimaraner,0.291539,1,chesapeake_bay_retriever,0.278966,1,koala,0.12701700000000002,0,,1.2
53,881666595344535552,2017-07-03 00:11:11+00:00,This is Gary. He couldn't miss this puppertunity for a selfie. Flawless focusing skills. 13/10 would boop intensely https://t.co/7CSWCl8I6s,Gary,9479,46585,https://pbs.twimg.com/media/DDxPFwbWAAEbVVR.jpg,1,saluki,0.529012,1,afghan_hound,0.25000300000000003,1,golden_retriever,0.16073900000000002,1,,1.3
55,881536004380872706,2017-07-02 15:32:16+00:00,"Here is a pupper approaching maximum borkdrive. Zooming at never before seen speeds. 14/10 paw-inspiring af 
(IG: puffie_the_chow) https://t.co/ghXBIIeQZF",,14217,45479,https://pbs.twimg.com/ext_tw_video_thumb/881535971568889856/pu/img/9bawiZ--8FKywTkz.jpg,1,samoyed,0.281463,1,angora,0.272066,0,persian_cat,0.114854,0,pupper,1.4
56,881268444196462592,2017-07-01 21:49:04+00:00,Meet Elliot. He's a Canadian Forrest Pup. Unusual number of antlers for a dog. Sneaky tongue slip to celebrate #Canada150. 12/10 would pet https://t.co/cgwJwowTMC,Elliot,4706,21410,https://pbs.twimg.com/media/DDrk-f9WAAI-WQv.jpg,1,tusker,0.473303,0,indian_elephant,0.245646,0,ibex,0.0556607,0,,1.2
57,880935762899988482,2017-06-30 23:47:07+00:00,This is Louis. He's crossing. It's a big deal. 13/10 h*ckin breathtaking https://t.co/D0wb1GlKAt,Louis,2485,15729,https://pbs.twimg.com/media/DDm2Z5aXUAEDS2u.jpg,1,street_sign,0.251801,0,umbrella,0.115123,0,traffic_light,0.0695338,0,,1.3
58,880872448815771648,2017-06-30 19:35:32+00:00,Ugh not again. We only rate dogs. Please don't send in well-dressed  floppy-tongued street penguins. Dogs only please. Thank you... 12/10 https://t.co/WiAMbTkDPf,,3399,19576,https://pbs.twimg.com/media/DDl8zzJW0AAisCJ.jpg,1,pembroke,0.791416,1,norwich_terrier,0.0613929,1,chihuahua,0.0337257,1,,1.2
59,880465832366813184,2017-06-29 16:39:47+00:00,This is Bella. She had her first beach experience this morning. Complete success. 12/10 would perform a sandy boop https://t.co/4VsFysDmiw,Bella,5520,26172,https://pbs.twimg.com/media/DDgK-J4XUAIEV9W.jpg,1,golden_retriever,0.913255,1,labrador_retriever,0.0263286,1,cocker_spaniel,0.00937082,1,,1.2
60,880221127280381952,2017-06-29 00:27:25+00:00,Meet Jesse. He's a Fetty Woof. His tongue ejects without warning. A true bleptomaniac. 12/10 would snug well https://t.co/fUod0tVmvK,Jesse,3692,24770,https://pbs.twimg.com/media/DDcscbXU0AIfDzs.jpg,1,chihuahua,0.238525,1,meerkat,0.104256,0,clumber,0.0525803,1,,1.2
61,880095782870896641,2017-06-28 16:09:20+00:00,Please don't send in photos without dogs in them. We're not @porch_rates. Insubordinate and churlish. Pretty good porch tho 11/10 https://t.co/HauE8M3Bu4,,3868,25417,https://pbs.twimg.com/media/DDa6ckbXgAAM1vV.jpg,1,miniature_pinscher,0.120298,1,rhodesian_ridgeback,0.106395,1,beagle,0.106073,1,,1.1
62,879862464715927552,2017-06-28 00:42:13+00:00,This is Romeo. He would like to do an entrance. Requesting your immediate assistance. 13/10 https://t.co/Qh5aEkRQm9,Romeo,3093,20598,https://pbs.twimg.com/media/DDXmPrbWAAEKMvy.jpg,3,basset,0.813507,1,beagle,0.146654,1,cocker_spaniel,0.00948502,1,,1.3
64,879492040517615616,2017-06-27 00:10:17+00:00,This is Bailey. He thinks you should measure ear length for signs of growth instead. 12/10 https://t.co/IxM9IMKQq8,Bailey,2822,21598,https://pbs.twimg.com/media/DDSVWMvXsAEgmMK.jpg,1,german_short_haired_pointer,0.479896,1,vizsla,0.124353,1,bath_towel,0.0733202,0,,1.2
65,879415818425184262,2017-06-26 19:07:24+00:00,This is Duddles. He did an attempt. 13/10 someone help him (vid by Georgia Felici) https://t.co/UDT7ZkcTgY,Duddles,39611,97255,https://pbs.twimg.com/ext_tw_video_thumb/879415784908390401/pu/img/cX7XI1TnUsseGET5.jpg,1,english_springer,0.383404,1,boston_bull,0.134967,1,cardigan,0.110481,1,,1.3
66,879376492567855104,2017-06-26 16:31:08+00:00,This is Jack AKA Stephen Furry. You're not scoring on him. Unless he slips down the slide. 12/10 would happily get blocked by https://t.co/0gOi601EAa,Jack,2779,15492,https://pbs.twimg.com/media/DDQsQGFV0AAw6u9.jpg,1,tricycle,0.663601,0,labrador_retriever,0.0334961,1,pembroke,0.0188266,1,,1.2
68,879050749262655488,2017-06-25 18:56:45+00:00,This is Steven. He has trouble relating to other dogs. Quite shy. Neck longer than average. Tropical probably. 11/10 would still pet https://t.co/2mJCDEJWdD,Steven,4178,20737,https://pbs.twimg.com/media/DDMD_phXoAQ1qf0.jpg,1,tabby,0.311861,0,window_screen,0.169123,0,egyptian_cat,0.132932,0,,1.1
69,879008229531029506,2017-06-25 16:07:47+00:00,This is Beau. That is Beau's balloon. He takes it everywhere. 13/10 would protect at all costs https://t.co/YDtpCjIPKN,Beau,2381,17491,https://pbs.twimg.com/media/DDLdUrqXYAMOVzY.jpg,1,vizsla,0.960513,1,miniature_pinscher,0.00943065,1,american_staffordshire_terrier,0.0087113,1,,1.3
70,878776093423087618,2017-06-25 00:45:22+00:00,This is Snoopy. He's a proud #PrideMonthPuppo. Impeccable handwriting for not having thumbs. 13/10 would love back #PrideMonth https://t.co/lNZwgNO4gS,Snoopy,3641,17836,https://pbs.twimg.com/media/DDIKMXzW0AEibje.jpg,2,italian_greyhound,0.734684,1,whippet,0.15048699999999998,1,ibizan_hound,0.0397246,1,puppo,1.3
74,878281511006478336,2017-06-23 16:00:04+00:00,"Meet Shadow. In an attempt to reach maximum zooming borkdrive, he tore his ACL. Still 13/10 tho. Help him out below

https://t.co/245xJJElsY https://t.co/lUiQH219v6",Shadow,1130,7117,https://pbs.twimg.com/media/DDBIX9QVYAAohGa.jpg,1,basset,0.32042,1,collie,0.215975,1,appenzeller,0.12850699999999998,1,,1.3
75,878057613040115712,2017-06-23 01:10:23+00:00,This is Emmy. She was adopted today. Massive round of pupplause for Emmy and her new family. 14/10 for all involved https://t.co/cwtWnHMVpe,Emmy,6054,38785,https://pbs.twimg.com/media/DC98vABUIAA97pz.jpg,1,french_bulldog,0.839097,1,boston_bull,0.07879939999999999,1,toy_terrier,0.0152434,1,,1.4
76,877736472329191424,2017-06-22 03:54:17+00:00,This is Aja. She was just told she's a good dog. Suspicions confirmed. 13/10 would tell again https://t.co/lsPyyAiF1r,Aja,16832,72779,https://pbs.twimg.com/media/DC5YqoQW0AArOLH.jpg,2,chesapeake_bay_retriever,0.8379559999999999,1,labrador_retriever,0.0620342,1,weimaraner,0.0405991,1,,1.3
78,877556246731214848,2017-06-21 15:58:08+00:00,This is Penny. She's both pupset and fired pup. Not pleased w your barbaric attempts at cleanliness. 12/10 would enjoy more shampoo options https://t.co/OYdDlfOGXP,Penny,3394,20911,https://pbs.twimg.com/media/DC20wEcW0AAf59m.jpg,1,basset,0.995368,1,welsh_springer_spaniel,0.00193621,1,bathtub,0.000467919,0,,1.2
79,877316821321428993,2017-06-21 00:06:44+00:00,"Meet Dante. At first he wasn't a fan of his new raincoat, then he saw his reflection. H*ckin handsome. 13/10 for water resistant good boy https://t.co/SHRTIo5pxc",Dante,4639,25263,https://pbs.twimg.com/media/DCza_vtXkAQXGpC.jpg,1,saluki,0.5099670000000001,1,italian_greyhound,0.0904973,1,golden_retriever,0.0794058,1,,1.3
80,877201837425926144,2017-06-20 16:29:50+00:00,This is Nelly. He graduated with his dogtorate today. Wants to know if you're proud of him. 12/10 would give congratulatory boop https://t.co/4g4cfj3P4Y,Nelly,4955,24963,https://pbs.twimg.com/media/DCxyahJWsAAddSC.jpg,1,pembroke,0.93112,1,cardigan,0.0686982,1,basenji,8.17379e-05,1,,1.2
81,876838120628539392,2017-06-19 16:24:33+00:00,This is Ginger. She's having a ruff Monday. Too many pupper things going on. H*ckin exhausting. 12/10 would snug passionately https://t.co/j211oCDRs6,Ginger,2973,19072,https://pbs.twimg.com/media/DCsnnZsVwAEfkyi.jpg,1,bloodhound,0.575751,1,redbone,0.24097,1,tibetan_mastiff,0.08893480000000001,1,pupper,1.2
83,876484053909872640,2017-06-18 16:57:37+00:00,This is Benedict. He wants to thank you for this delightful urban walk. Hopes you know he loves you. 13/10 super duper good boy https://t.co/26BXueUgbs,Benedict,2109,17315,https://pbs.twimg.com/media/DCnll_dUQAAkBdG.jpg,1,golden_retriever,0.874566,1,irish_terrier,0.0373542,1,chow,0.016723599999999998,1,,1.3
84,876120275196170240,2017-06-17 16:52:05+00:00,"Meet Venti, a seemingly caffeinated puppoccino. She was just informed the weekend would include walks, pats and scritches. 13/10 much excite https://t.co/ejExJFq3ek",Venti,4154,25816,https://pbs.twimg.com/media/DCiavj_UwAAcXep.jpg,1,bernese_mountain_dog,0.534327,1,saint_bernard,0.346312,1,greater_swiss_mountain_dog,0.0949327,1,,1.3
85,875747767867523072,2017-06-16 16:11:53+00:00,"This is Goose. He's a womanizer. Cheeky as h*ck, but also deep. Tongue slip game on another level. 13/10 will steal your girl https://t.co/V2WlACRJCN",Goose,3808,23156,https://pbs.twimg.com/media/DCdH8YpUQAAiEbL.jpg,1,labrador_retriever,0.799551,1,chesapeake_bay_retriever,0.179975,1,vizsla,0.0046176,1,,1.3
86,875144289856114688,2017-06-15 00:13:52+00:00,Meet Nugget and Hank. Nugget took Hank's bone. Hank is wondering if you would please return it to him. Both 13/10 would not intervene https://t.co/ogith9ejNj,Nugget,4384,20249,https://pbs.twimg.com/ext_tw_video_thumb/875144175078957056/pu/img/BRi_l7vUdpb93Knf.jpg,1,siberian_husky,0.245048,1,pembroke,0.223716,1,dingo,0.160753,0,,1.3
88,875021211251597312,2017-06-14 16:04:48+00:00,Guys please stop sending pictures without any dogs in th- oh never mind hello excuse me sir. 12/10 stealthy as h*ck https://t.co/brCQoqc8AW,,4207,23552,https://pbs.twimg.com/media/DCSzF3NVoAAPzT4.jpg,2,west_highland_white_terrier,0.7143189999999999,1,siberian_husky,0.0919133,1,great_pyrenees,0.0460382,1,,1.2
