,tweet_id,timestamp,text,dog_name,retweet_count,favorite_count,jpg_url,img_num,first_pred_group,first_pred_conf,is_first_pred_dog,second_pred_group,second_pred_conf,is_second_pred_dog,third_pred_group,third_pred_conf,is_third_pred_dog,dog_stage,final_rating
617,793601777308463104,2016-11-01 23:53:02+00:00,This is Dobby. I can't stop looking at her feet. 12/10 would absolutely snug https://t.co/LhzPWv6rTv,Dobby,1611,7954,https://pbs.twimg.com/media/CwNwmxvXEAEJ54Z.jpg,1,miniature_pinscher,0.538981,1,chihuahua,0.21783,1,toy_terrier,0.0891487,1,,1.2
618,793500921481273345,2016-11-01 17:12:16+00:00,This is Fiona. She's an extremely mediocre copilot. Very distracting. Wink makes up for all the missed turns. 12/10 https://t.co/aF5MmpvPqN,Fiona,2361,10650,https://pbs.twimg.com/media/CwMU34YWIAAz1nU.jpg,2,golden_retriever,0.326122,1,labrador_retriever,0.219904,1,chesapeake_bay_retriever,0.163366,1,,1.2
619,793286476301799424,2016-11-01 03:00:09+00:00,This is Moreton. He's the Good Boy Who Lived. 13/10 magical as h*ck https://t.co/rLHGx3VAF3,Moreton,9130,24545,https://pbs.twimg.com/media/CwJR1okWIAA6XMp.jpg,1,afghan_hound,0.274637,1,borzoi,0.142204,1,doormat,0.109677,0,,1.3
620,793271401113350145,2016-11-01 02:00:14+00:00,Meet Dave. It's his favorite day of the year. He gets to fulfill his dream of being a dinosaur. 12/10 inspirational af https://t.co/MgQSdfZGPN,Dave,2383,8671,https://pbs.twimg.com/media/CwJEIKTWYAAvL-T.jpg,1,siberian_husky,0.231695,1,eskimo_dog,0.206749,1,pembroke,0.0701195,1,,1.2
621,793256262322548741,2016-11-01 01:00:05+00:00,Oh h*ck look at this spookling right here. Fright level off the charts. 12/10 sufficiently spooked https://t.co/BNy9IIJMb0,,8305,19942,https://pbs.twimg.com/media/CwI2XCvXEAEO8mc.jpg,1,basset,0.207622,1,walker_hound,0.0605742,1,beagle,0.0412205,1,,1.2
622,793241302385262592,2016-11-01 00:00:38+00:00,This is Tucker. He's out here bustin h*ckin ghosts. 13/10 dedicated af https://t.co/Ap477GhwXt,Tucker,3282,10488,https://pbs.twimg.com/media/CwIougTWcAAMLyq.jpg,1,golden_retriever,0.559308,1,labrador_retriever,0.390222,1,cocker_spaniel,0.0363157,1,,1.3
623,793226087023144960,2016-10-31 23:00:11+00:00,"This is Juno. She spooked me up real good, but only to get my attention. Above average handwriting for a dog I think. 11/10 https://t.co/hFxxBCWlwj",Juno,2873,9795,https://pbs.twimg.com/media/CwIa5CjW8AErZgL.jpg,1,wire_haired_fox_terrier,0.456047,1,lakeland_terrier,0.273428,1,english_springer,0.0836433,1,,1.1
624,793210959003287553,2016-10-31 22:00:04+00:00,This is Maude. She's the h*ckin happiest wasp you've ever seen. 10/10 would pet with caution https://t.co/etL8FHBrh8,Maude,2782,8906,https://pbs.twimg.com/media/CwINKJeW8AYHVkn.jpg,1,doormat,0.874431,0,french_bulldog,0.0187591,1,boston_bull,0.0151344,1,,1.0
625,793195938047070209,2016-10-31 21:00:23+00:00,Say hello to Lily. She's pupset that her costume doesn't fit as well as last year. 12/10 poor puppo https://t.co/YSi6K1firY,Lily,5602,15217,https://pbs.twimg.com/media/CwH_foYWgAEvTyI.jpg,2,labrador_retriever,0.654762,1,golden_retriever,0.0741,1,chihuahua,0.0423393,1,puppo,1.2
626,793180763617361921,2016-10-31 20:00:05+00:00,This is Newt. He's a strawberry. 11/10 https://t.co/2VhmlwxA1Q,Newt,1990,6912,https://pbs.twimg.com/media/CwHxsdYVMAAqGCJ.jpg,1,lakeland_terrier,0.266824,1,irish_terrier,0.218783,1,airedale,0.13296,1,,1.1
627,793165685325201412,2016-10-31 19:00:10+00:00,This is Benji. He's Air Bud. It's a low effort costume but he pulls it off rather h*ckin well. 12/10 would happily get dunked on https://t.co/IbzT7DJvBo,Benji,2774,9359,https://pbs.twimg.com/media/CwHj-jGWAAAnsny.jpg,1,golden_retriever,0.946224,1,labrador_retriever,0.0364766,1,doormat,0.00235285,0,,1.2
628,793150605191548928,2016-10-31 18:00:14+00:00,This is Nida. She's a free elf. Waited so long for this day. 11/10 https://t.co/3lE8Izgmkf,Nida,1695,6159,https://pbs.twimg.com/media/CwHWOZ7W8AAHv8S.jpg,1,italian_greyhound,0.193869,1,bluetick,0.16038,1,standard_poodle,0.12598199999999998,1,,1.1
629,793135492858580992,2016-10-31 17:00:11+00:00,Your favorite squad is looking extra h*ckin spooky today. 13/10 for all https://t.co/PrgvOyPtDT,,2487,6390,https://pbs.twimg.com/media/CwHIg61WIAApnEV.jpg,1,bakery,0.737041,0,saltshaker,0.05239590000000001,0,teddy,0.0465926,0,,1.3
630,793120401413079041,2016-10-31 16:00:13+00:00,"This is Robin. She's desperately trying to do me a frighten, but her tongue drastically decreases her spook value. Still 11/10 great effort https://t.co/sxMrsOZ8zb",Robin,3907,12618,https://pbs.twimg.com/media/CwG6zDfWcAA8jBD.jpg,1,labrador_retriever,0.7249439999999999,1,golden_retriever,0.169744,1,kuvasz,0.0355023,1,,1.1
631,792913359805018113,2016-10-31 02:17:31+00:00,Here is a perfect example of someone who has their priorities in order. 13/10 for both owner and Forrest https://t.co/LRyMrU7Wfq,,3957,14294,https://pbs.twimg.com/media/CwD-eCLWIAA6v0B.jpg,4,web_site,0.226716,0,lighter,0.0819414,0,switch,0.0390086,0,,1.3
632,792883833364439040,2016-10-31 00:20:11+00:00,This is Bailey. She's rather h*ckin hype for Halloween tomorrow. Carved those pupkins herself. 12/10 https://t.co/v17mFm0Ftz,Bailey,4254,11278,https://pbs.twimg.com/media/CwDjoH3WAAIniIs.jpg,3,jack_o'_lantern,0.999306,0,basketball,0.000113129,0,standard_poodle,8.31451e-05,1,,1.2
633,792773781206999040,2016-10-30 17:02:53+00:00,This is Monster. Not an actual monster tho. He's showing you his tongue. Very impressive Monster. 12/10 would snug https://t.co/RhaPExuxJL,Monster,1671,7341,https://pbs.twimg.com/media/CwB_i-zXEAEiP29.jpg,1,yorkshire_terrier,0.912804,1,silky_terrier,0.06782250000000001,1,australian_terrier,0.00445069,1,,1.2
634,792394556390137856,2016-10-29 15:55:58+00:00,Meet BeBe. She rocks the messy bun of your dreams. H*ckin flawless. 12/10 would watch her tutorial https://t.co/of0pFNBIl8,BeBe,4282,13400,https://pbs.twimg.com/media/Cv8moW9W8AIHOxR.jpg,2,cocker_spaniel,0.746387,1,irish_setter,0.0916151,1,miniature_poodle,0.061078199999999985,1,,1.2
635,792050063153438720,2016-10-28 17:07:05+00:00,This is Remus. He's a mop that came to life. Can't see anything. Constantly trips over himself. Still a very good dog. 11/10 https://t.co/S3f1SYylzu,Remus,1786,7142,https://pbs.twimg.com/media/Cv3tU38WcAASFas.jpg,2,komondor,0.942856,1,swab,0.05271519999999999,0,tibetan_terrier,0.002743,1,,1.1
640,791672322847637504,2016-10-27 16:06:04+00:00,When she says you're a good boy and you know you're a good boy because you're a good boy. 13/10 https://t.co/O5IUmRHRIh,,3120,11716,https://pbs.twimg.com/media/CvyVxQRWEAAdSZS.jpg,1,golden_retriever,0.705092,1,labrador_retriever,0.219721,1,kuvasz,0.015965,1,,1.3
641,791406955684368384,2016-10-26 22:31:36+00:00,Say hello to Levi. He's a Madagascan Butterbop. One of the more docile Butterbops I've seen. 12/10 would give all the pets https://t.co/Zcw9Sccctc,Levi,4094,13123,https://pbs.twimg.com/media/CvukbEkWAAAV-69.jpg,4,pembroke,0.972629,1,cardigan,0.0270259,1,basenji,0.000152502,1,,1.2
642,791312159183634433,2016-10-26 16:14:55+00:00,This is Mabel. She's super h*ckin smol. Portable af. Comes with the smol shoe. 12/10 would keep in frocket https://t.co/GGJvxYt3xK,Mabel,2522,8742,https://pbs.twimg.com/media/CvtONV4WAAAQ3Rn.jpg,4,miniature_pinscher,0.892925,1,toy_terrier,0.0955238,1,doberman,0.00354426,1,,1.2
644,790987426131050500,2016-10-25 18:44:32+00:00,This is Misty. She has a cowboy hat on her nose. 12/10 https://t.co/Eno0mypHIr,Misty,2128,9802,https://pbs.twimg.com/media/Cvom3ZJXEAE29TD.jpg,1,cocker_spaniel,0.349195,1,flat_coated_retriever,0.309535,1,newfoundland,0.104768,1,,1.2
645,790946055508652032,2016-10-25 16:00:09+00:00,This is Betty. She's assisting with the dishes. Such a good puppo. 12/10 h*ckin helpful af https://t.co/dgvTPZ9tgI,Betty,4678,16630,https://pbs.twimg.com/media/CvoBPWRWgAA4het.jpg,1,dishwasher,0.700466,0,golden_retriever,0.245773,1,chow,0.0390117,1,puppo,1.2
647,790698755171364864,2016-10-24 23:37:28+00:00,This is Mosby. He appears to be rather h*ckin snuggable af. 12/10 keep it up Mosby https://t.co/IiiBq460I7,Mosby,1916,8197,https://pbs.twimg.com/media/CvkgUjbUsAEvo7l.jpg,1,bernese_mountain_dog,0.996541,1,entlebucher,0.00105698,1,appenzeller,0.000997907,1,,1.2
648,790581949425475584,2016-10-24 15:53:19+00:00,This is Duke. He sneaks into the fridge sometimes. It's his safe place. 11/10 would give little jacket if necessary https://t.co/Fd5WFDTMH4,Duke,7096,20618,https://pbs.twimg.com/media/Cvi2FiKWgAAif1u.jpg,2,refrigerator,0.998886,0,malinois,0.000152999,1,kelpie,0.000130817,1,,1.1
649,790337589677002753,2016-10-23 23:42:19+00:00,Meet Maggie. She can hear your cells divide. 12/10 can also probably fly https://t.co/ovE2hqXryV,Maggie,1873,7798,https://pbs.twimg.com/media/CvfX2AnWYAAQTay.jpg,1,pembroke,0.658808,1,cardigan,0.153096,1,toy_terrier,0.102299,1,,1.2
650,790277117346975746,2016-10-23 19:42:02+00:00,This is Bruce. He never backs down from a challenge. 11/10 you got this Bruce https://t.co/aI7umZHIq7,Bruce,3164,12524,https://pbs.twimg.com/media/Cveg1-NXgAASaaT.jpg,1,labrador_retriever,0.427742,1,great_dane,0.190503,1,curly_coated_retriever,0.146427,1,,1.1
652,789986466051088384,2016-10-23 00:27:05+00:00,This is Happy. He's a bathtub reviewer. Seems to be pleased with this one. 12/10 https://t.co/Ln89R4FP7v,Happy,2300,9230,https://pbs.twimg.com/media/CvaYgDOWgAEfjls.jpg,1,tub,0.479477,0,bathtub,0.325106,0,golden_retriever,0.07853049999999999,1,,1.2
655,789628658055020548,2016-10-22 00:45:17+00:00,This is Eli. He can fly. 13/10 magical af https://t.co/huPSJJ7FDI,Eli,1754,7470,https://pbs.twimg.com/media/CvVTEnPXYAAWLyL.jpg,1,chow,0.260702,1,cougar,0.0881427,0,pomeranian,0.0798831,1,,1.3
656,789599242079838210,2016-10-21 22:48:24+00:00,This is Brownie. She's wearing a Halloween themed onesie. 12/10 festive af https://t.co/0R4meWXFOx,Brownie,1917,6725,https://pbs.twimg.com/media/CvU4UZpXgAE1pAV.jpg,2,chesapeake_bay_retriever,0.8788219999999999,1,beagle,0.0185703,1,labrador_retriever,0.0174985,1,,1.2
657,789530877013393408,2016-10-21 18:16:44+00:00,This is Rizzy. She smiles a lot. 12/10 contagious af https://t.co/TU4sZogVIq,Rizzy,3360,11700,https://pbs.twimg.com/media/CvT6IV6WEAQhhV5.jpg,3,schipperke,0.363272,1,kelpie,0.197021,1,norwegian_elkhound,0.151024,1,,1.2
660,789268448748703744,2016-10-21 00:53:56+00:00,This is Stella. She's happier than I will ever be. 10/10 would trade lives with https://t.co/JSs2bfDtTS,Stella,2595,9089,https://pbs.twimg.com/media/CvQLdotWcAAZn86.jpg,1,malamute,0.81286,1,siberian_husky,0.120853,1,eskimo_dog,0.0242693,1,,1.0
661,789137962068021249,2016-10-20 16:15:26+00:00,This is Bo. He's a West Congolese Bugaboop Snuggle. Rather exotic. Master of the head tilt. 12/10 would pay to pet https://t.co/2jwxxtNzoN,Bo,2778,9699,https://pbs.twimg.com/media/CvOUw8vWYAAzJDq.jpg,2,chihuahua,0.746135,1,pekinese,0.0703834,1,pembroke,0.0492369,1,,1.2
662,788908386943430656,2016-10-20 01:03:11+00:00,"This is Lucy. She destroyed not one, but two remotes trying to turn off the debate. 11/10 relatable af https://t.co/3BXh073tDm",Lucy,12434,27348,https://pbs.twimg.com/media/CvLD-mbWYAAFI8w.jpg,1,remote_control,0.8815379999999999,0,oscilloscope,0.0355131,0,golden_retriever,0.0340897,1,,1.1
663,788765914992902144,2016-10-19 15:37:03+00:00,This is Butter. She can have whatever she wants forever. 12/10 would hug softly https://t.co/x5gXRS1abq,Butter,10230,27235,https://pbs.twimg.com/media/CvJCabcWgAIoUxW.jpg,1,cocker_spaniel,0.500509,1,golden_retriever,0.27273400000000003,1,jigsaw_puzzle,0.041475800000000014,0,,1.2
665,788412144018661376,2016-10-18 16:11:17+00:00,This is Dexter. He breaks hearts for a living. 11/10 h*ckin handsome af https://t.co/4DhSsC1W7S,Dexter,5237,15510,https://pbs.twimg.com/media/CvEAqQoWgAADj5K.jpg,1,golden_retriever,0.805238,1,labrador_retriever,0.113798,1,brittany_spaniel,0.0385587,1,,1.1
666,788178268662984705,2016-10-18 00:41:57+00:00,Atlas is back and this time he's got doggles. Still 13/10 solarly conscious af https://t.co/s7MgFWDySc,,2090,7211,https://pbs.twimg.com/media/CvAr88kW8AEKNAO.jpg,2,samoyed,0.73548,1,pomeranian,0.075101,1,arctic_fox,0.0360719,0,,1.3
667,788150585577050112,2016-10-17 22:51:57+00:00,This is Leo. He's a golden chow. Rather h*ckin rare. 13/10 would give extra pats https://t.co/xosHjFzVXc,Leo,1270,6098,https://pbs.twimg.com/media/CvASw6dWcAQmo3X.jpg,3,chow,0.814145,1,pomeranian,0.112704,1,chihuahua,0.0158832,1,,1.3
669,788039637453406209,2016-10-17 15:31:05+00:00,Did... did they pick out that license plate? 12/10 for both https://t.co/lRmUUOxgbQ,,1307,6104,https://pbs.twimg.com/media/Cu-t20yWEAAFHXi.jpg,1,beach_wagon,0.362925,0,minivan,0.304759,0,limousine,0.101702,0,,1.2
670,787810552592695296,2016-10-17 00:20:47+00:00,This is Frank. He wears sunglasses and walks himself. 11/10 I'll never be this cool or independent https://t.co/pNNjBtHWPc,Frank,3032,8594,https://pbs.twimg.com/media/Cu7dg2RXYAIaGXE.jpg,2,pug,0.362835,1,french_bulldog,0.221864,1,english_setter,0.0804183,1,,1.1
671,787717603741622272,2016-10-16 18:11:26+00:00,This is Tonks. She is a service puppo. Can hear a caterpillar hiccup from 7 miles away. 13/10 would follow anywhere https://t.co/i622ZbWkUp,Tonks,2762,10235,https://pbs.twimg.com/media/Cu6I9vvWIAAZG0a.jpg,3,german_shepherd,0.992339,1,malinois,0.00492039,1,kelpie,0.0008528019999999999,1,puppo,1.3
672,787397959788929025,2016-10-15 21:01:17+00:00,This is Moose. He's rather h*ckin dangerous (you can tell by the collar). 11/10 would still attempt to snug https://t.co/lHVHGdDzb3,Moose,2836,10843,https://pbs.twimg.com/media/Cu1mQsDWEAAU_VQ.jpg,1,chihuahua,0.900483,1,toy_terrier,0.0210845,1,miniature_pinscher,0.019484,1,,1.1
673,787322443945877504,2016-10-15 16:01:13+00:00,This is Lincoln. He forgot to use his blinker when he changed lanes just now. Guilty as h*ck. Still 10/10 https://t.co/lsrR83SiVp,Lincoln,1733,7750,https://pbs.twimg.com/media/Cu0hlfwWYAEdnXO.jpg,1,seat_belt,0.747739,0,golden_retriever,0.105703,1,dingo,0.0172568,0,,1.0
675,786963064373534720,2016-10-14 16:13:10+00:00,This is Rory. He's got an interview in a few minutes. Looking spiffy af. Nervous as h*ck tho. 12/10 would hire https://t.co/ibj5g6xaAj,Rory,7936,26562,https://pbs.twimg.com/media/Cuvau3MW8AAxaRv.jpg,1,golden_retriever,0.915303,1,saluki,0.0462126,1,labrador_retriever,0.0375041,1,,1.2
678,786664955043049472,2016-10-13 20:28:35+00:00,"""Honestly Kathleen I just want more Ken Bone"" 12/10 https://t.co/HmlEvAMP4r",,2529,10548,https://pbs.twimg.com/media/CurLmoqXgAEPoJ-.jpg,1,leonberg,0.512034,1,keeshond,0.464816,1,pomeranian,0.00781249,1,,1.2
679,786595970293370880,2016-10-13 15:54:28+00:00,This is Dale. He's a real spookster. Did me quite the frighten. 11/10 not too spooky to pet tho https://t.co/L8BWDD4oBX,Dale,3111,9411,https://pbs.twimg.com/media/CuqM0fVWAAAboKR.jpg,1,pembroke,0.709512,1,cardigan,0.28717800000000004,1,chow,0.000570176,1,,1.1
680,786363235746385920,2016-10-13 00:29:39+00:00,This is Rizzo. He has many talents. A true renaissance doggo. 13/10 entertaining af https://t.co/TVXpEJB7Wn,Rizzo,3469,10847,https://pbs.twimg.com/media/Cum5LlfWAAAyPcS.jpg,1,golden_retriever,0.929266,1,labrador_retriever,0.0628667,1,saluki,0.00215669,1,doggo,1.3
682,786233965241827333,2016-10-12 15:55:59+00:00,This is Mattie. She's extremely dangerous. Will bite your h*ckin finger right off. Still 11/10 would pet with caution https://t.co/78c9W8kLFh,Mattie,4692,15164,https://pbs.twimg.com/media/CulDnZpWcAAGbZ-.jpg,1,labrador_retriever,0.478193,1,schipperke,0.224817,1,staffordshire_bullterrier,0.0773956,1,,1.1
685,785927819176054784,2016-10-11 19:39:28+00:00,This is Lucy. She's strives to be the best potato she can be. 12/10 would boop https://t.co/lntsj7Fc4Y,Lucy,3162,11342,https://pbs.twimg.com/media/CugtKeXWEAAamDZ.jpg,1,teddy,0.97207,0,toy_poodle,0.00849262,1,chow,0.00288271,1,,1.2
686,785872687017132033,2016-10-11 16:00:24+00:00,Meet Rusty. He appears to be rather h*ckin fluffy. Also downright adorable af. 12/10 would rub my face against his https://t.co/1j9kLGb4wV,Rusty,1793,6672,https://pbs.twimg.com/ext_tw_video_thumb/785872596088811520/pu/img/5O-_BgqdFQu_2Bt7.jpg,1,great_pyrenees,0.392108,1,golden_retriever,0.198358,1,pekinese,0.143328,1,,1.2
687,785639753186217984,2016-10-11 00:34:48+00:00,This is Pinot. He's a sophisticated doggo. You can tell by the hat. Also pointier than your average pupper. Still 10/10 would pet cautiously https://t.co/f2wmLZTPHd,Pinot,2225,7829,https://pbs.twimg.com/media/CucnLmeWAAALOSC.jpg,1,porcupine,0.978042,0,sea_urchin,0.0061063,0,echidna,0.00544197,0,multiple_categories,1.0
688,785533386513321988,2016-10-10 17:32:08+00:00,This is Dallas. Her tongue is ridiculous. 11/10 h*ckin proud af https://t.co/h4jhlH4EyG,Dallas,1982,9067,https://pbs.twimg.com/media/CubGchjXEAA6gpw.jpg,2,miniature_pinscher,0.436023,1,black_and_tan_coonhound,0.258049,1,rottweiler,0.145231,1,,1.1
690,785264754247995392,2016-10-09 23:44:41+00:00,This is Doc. He requested to be carried around like that. 12/10 anything for Doc https://t.co/mWYACm4qnx,Doc,1612,7225,https://pbs.twimg.com/media/CuXSHNnWcAIWEwn.jpg,1,teddy,0.6748930000000001,0,cradle,0.0567396,0,chow,0.056137,1,,1.2
691,785170936622350336,2016-10-09 17:31:53+00:00,This is Hero. He was enjoying the car ride until he remembered that bees are dying globally at an alarming rate. 11/10 https://t.co/cubFg7F4qQ,Hero,4791,11970,https://pbs.twimg.com/media/CuV8yfxXEAAUlye.jpg,2,seat_belt,0.891193,0,eskimo_dog,0.0274944,1,samoyed,0.0195303,1,,1.1
692,784826020293709826,2016-10-08 18:41:19+00:00,This is Rusty. He's going D1 for sure. Insane vertical. 13/10 would draft https://t.co/AsykOwMrXQ,Rusty,3227,10054,https://pbs.twimg.com/media/CuRDF-XWcAIZSer.jpg,1,chow,0.0903414,1,binoculars,0.08349880000000001,0,irish_setter,0.0774556,1,,1.3
693,784517518371221505,2016-10-07 22:15:26+00:00,This is Frankie. He has yet to learn how to control his tongue. 11/10 maybe one day https://t.co/p6fgYe2dB6,Frankie,2507,8928,https://pbs.twimg.com/media/CuMqhGrXYAQwRqU.jpg,2,malamute,0.757764,1,eskimo_dog,0.151248,1,siberian_husky,0.08484019999999999,1,,1.1
694,784431430411685888,2016-10-07 16:33:21+00:00,This is Stormy. He's curly af. Already pupared for Coachella next year. 12/10 https://t.co/PHA1vtqqpt,Stormy,1263,5693,https://pbs.twimg.com/media/CuLcNkCXgAEIwK2.jpg,1,miniature_poodle,0.744819,1,toy_poodle,0.243192,1,standard_poodle,0.0109202,1,,1.2
697,783839966405230592,2016-10-06 01:23:05+00:00,This is Riley. His owner put a donut pillow around him and he loves it so much he won't let anyone take it off. 13/10 https://t.co/8TCQcsZCZ8,Riley,10694,29855,https://pbs.twimg.com/media/CuDCSM-XEAAJw1W.jpg,1,quilt,0.333739,0,siamese_cat,0.136245,0,three_toed_sloth,0.117464,0,,1.3
698,783821107061198850,2016-10-06 00:08:09+00:00,This is Mairi. She has mastered the art of camouflage. 12/10 h*ckin sneaky af https://t.co/STcPjiNAHp,Mairi,1953,7321,https://pbs.twimg.com/media/CuCxIzyWEAQTnQA.jpg,1,lakeland_terrier,0.26565900000000003,1,golden_retriever,0.196414,1,standard_poodle,0.133534,1,,1.2
699,783695101801398276,2016-10-05 15:47:27+00:00,This is Loomis. He's the leader of the Kenneth search party. The passion is almost overwhelming. 12/10 one day he will be free https://t.co/kCRKlFg4AY,Loomis,3183,10425,https://pbs.twimg.com/media/CuA-iRHXYAAWP8e.jpg,3,chow,0.314265,1,golden_retriever,0.300435,1,australian_terrier,0.0494869,1,,1.2
700,783466772167098368,2016-10-05 00:40:09+00:00,This is Finn. He likes eavesdropping from filing cabinets. It's a real issue but no one has approached him about it. 11/10 would still pet https://t.co/s8W8Del9HQ,Finn,2224,8409,https://pbs.twimg.com/media/Ct9u3ljW8AEnVIm.jpg,1,chihuahua,0.789,1,miniature_pinscher,0.115916,1,toy_terrier,0.0362939,1,,1.1
701,783391753726550016,2016-10-04 19:42:03+00:00,Meet Godi. He's an avid beachgoer and part time rainbow summoner. Eyeliner flawless af. 13/10 would snug well https://t.co/BO936YdJdi,Godi,5420,16785,https://pbs.twimg.com/media/Ct8qn8EWIAAk9zP.jpg,4,norwegian_elkhound,0.87713,1,cairn,0.0862406,1,keeshond,0.0110191,1,,1.3
703,783334639985389568,2016-10-04 15:55:06+00:00,This is Dave. He's currently in a predicament. Doesn't seem to mind tho. 12/10 someone assist Dave https://t.co/nfprKAXqwu,Dave,11571,28969,https://pbs.twimg.com/media/Ct72q9jWcAAhlnw.jpg,2,cardigan,0.593858,1,shetland_sheepdog,0.13061099999999998,1,pembroke,0.100842,1,,1.2
704,783085703974514689,2016-10-03 23:25:55+00:00,This is Earl. He can't catch. Did his best tho. 11/10 would repair confidence with extra pats https://t.co/IsqyvbjFgM,Earl,2182,8117,https://pbs.twimg.com/media/Ct4URfWUAAQ7lKe.jpg,1,chesapeake_bay_retriever,0.240602,1,airedale,0.164088,1,boxer,0.134506,1,,1.1
705,782969140009107456,2016-10-03 15:42:44+00:00,This is Cali. She arrived preassembled. Convenient af. 12/10 appears to be rather h*ckin pettable https://t.co/vOBV1ZqVcX,Cali,7312,24015,https://pbs.twimg.com/media/Ct2qO5PXEAE6eB0.jpg,1,seat_belt,0.474292,0,golden_retriever,0.17139300000000002,1,labrador_retriever,0.110592,1,,1.2
706,782747134529531904,2016-10-03 01:00:34+00:00,This is Deacon. He's the happiest almost dry doggo I've ever seen. 11/10 would smile back https://t.co/C6fUMnHt1H,Deacon,1399,7427,https://pbs.twimg.com/media/CtzgXgeXYAA1Gxw.jpg,1,golden_retriever,0.560699,1,otterhound,0.199482,1,clumber,0.0406818,1,doggo,1.1
707,782722598790725632,2016-10-02 23:23:04+00:00,"This is Penny. She fought a bee and the bee won. 10/10 you're fine Penny, everything's fine https://t.co/zrMVdfFej6",Penny,5344,17152,https://pbs.twimg.com/media/CtzKC7zXEAALfSo.jpg,1,irish_setter,0.574557,1,golden_retriever,0.339251,1,seat_belt,0.0461082,0,,1.0
708,782598640137187329,2016-10-02 15:10:30+00:00,This is Timmy. He's quite large. According to a trusted source it's actually a dog wearing a dog suit. 11/10 https://t.co/BIUchFwHqn,Timmy,1864,7747,https://pbs.twimg.com/media/CtxZTtxUMAEduGo.jpg,1,malamute,0.8408709999999999,1,tibetan_mastiff,0.140516,1,eskimo_dog,0.0120116,1,,1.1
709,782305867769217024,2016-10-01 19:47:08+00:00,This is Sampson. He just graduated. Ready to be a doggo now. Time for the real world. 12/10 have fun with taxes https://t.co/pgVKxRw0s1,Sampson,5503,16547,https://pbs.twimg.com/media/CttPBt0WIAAcsDE.jpg,1,briard,0.5044270000000001,1,soft_coated_wheaten_terrier,0.390678,1,lhasa,0.0345955,1,doggo,1.2
711,781955203444699136,2016-09-30 20:33:43+00:00,This is Chipson. He weighed in at .3 ounces and is officially super h*ckin smol. Space-saving af. 11/10 would snug delicately https://t.co/FjEsk7A1JV,Chipson,3339,11063,https://pbs.twimg.com/media/CtoQGu4XgAQgv5m.jpg,1,pool_table,0.179568,0,dining_table,0.154396,0,microwave,0.0336905,0,,1.1
712,781661882474196992,2016-09-30 01:08:10+00:00,Who keeps sending in pictures without dogs in them? This needs to stop. 5/10 for the mediocre road https://t.co/ELqelxWMrC,,2694,10373,https://pbs.twimg.com/media/CtkFS72WcAAiUrs.jpg,1,pembroke,0.438087,1,golden_retriever,0.226954,1,collie,0.07065160000000001,1,,0.5
714,781524693396357120,2016-09-29 16:03:01+00:00,Idk why this keeps happening. We only rate dogs. Not Bangladeshi Couch Chipmunks. Please only send dogs... 12/10 https://t.co/ya7bviQUUf,,5514,20629,https://pbs.twimg.com/media/CtiIj0AWcAEBDvw.jpg,1,tennis_ball,0.994712,0,chesapeake_bay_retriever,0.0035225,1,labrador_retriever,0.000921439,1,,1.2
716,781251288990355457,2016-09-28 21:56:36+00:00,This is Oakley. He just got yelled at for going 46 in a 45. Churlish af. 11/10 would still pet so well https://t.co/xIYsa6LPA4,Oakley,2061,8374,https://pbs.twimg.com/media/CteP5H5WcAEhdLO.jpg,2,mexican_hairless,0.8877709999999999,1,italian_greyhound,0.0306664,1,seat_belt,0.0267298,0,,1.1
717,781163403222056960,2016-09-28 16:07:23+00:00,"We normally don't rate lobsters, but this one appears to be a really good lobster. 10/10 would pet with caution https://t.co/YkHc7U7uUy",,2729,9752,https://pbs.twimg.com/media/Ctc_-BTWEAAQpZh.jpg,1,shetland_sheepdog,0.973841,1,collie,0.0251876,1,border_collie,0.000297311,1,,1.0
718,780931614150983680,2016-09-28 00:46:20+00:00,I want to finally rate this iconic puppo who thinks the parade is all for him. 13/10 would absolutely attend https://t.co/5dUYOu4b8d,,7225,21486,https://pbs.twimg.com/media/CtZtJxAXEAAyPGd.jpg,1,padlock,0.731564,0,necklace,0.0654616,0,chain,0.0364691,0,puppo,1.3
719,780858289093574656,2016-09-27 19:54:58+00:00,"This is Dash. He's very stylish, but also incredibly unimpressed with the current state of our nation. 10/10 would pet ears first https://t.co/YElO4hvXI6",Dash,1988,7139,https://pbs.twimg.com/media/CtYqeNHWgAATqYZ.jpg,1,chesapeake_bay_retriever,0.488555,1,sussex_spaniel,0.27165500000000004,1,kelpie,0.106913,1,,1.0
720,780800785462489090,2016-09-27 16:06:28+00:00,This is Koda. He has a weird relationship with tall grass. Slightly concerning. 11/10 would def still pet https://t.co/KQzSR8eCsw,Koda,1287,5442,https://pbs.twimg.com/media/CtX2Kr9XYAAuxrM.jpg,2,siberian_husky,0.951963,1,eskimo_dog,0.0353461,1,pembroke,0.00886194,1,,1.1
721,780601303617732608,2016-09-27 02:53:48+00:00,Meet Hercules. He can have whatever he wants for the rest of eternity. 12/10 would snug passionately https://t.co/mH0IOyFdIG,Hercules,3337,12021,https://pbs.twimg.com/media/CtVAvX-WIAAcGTf.jpg,1,saint_bernard,0.995143,1,cardigan,0.00304359,1,english_springer,0.00104955,1,,1.2
722,780543529827336192,2016-09-26 23:04:13+00:00,Here's a perturbed super floof. 12/10 would snug so damn well https://t.co/VG095mi09Q,,1734,6255,https://pbs.twimg.com/media/CtUMLzRXgAAbZK5.jpg,1,golden_retriever,0.628312,1,labrador_retriever,0.317365,1,tibetan_mastiff,0.0122601,1,,1.2
725,780459368902959104,2016-09-26 17:29:48+00:00,"This is Bear. Don't worry, he's not a real bear tho. Contains unreal amounts of squish. 11/10 heteroskedastic af https://t.co/coi4l1T2Sm",Bear,1067,5259,https://pbs.twimg.com/media/CtS_p9kXEAE2nh8.jpg,1,great_dane,0.382491,1,german_shepherd,0.312026,1,bull_mastiff,0.0332719,1,,1.1
