,tweet_id,timestamp,text,dog_name,retweet_count,favorite_count,jpg_url,img_num,first_pred_group,first_pred_conf,is_first_pred_dog,second_pred_group,second_pred_conf,is_second_pred_dog,third_pred_group,third_pred_conf,is_third_pred_dog,dog_stage,final_rating
1750,678021115718029313,2015-12-19 01:16:45+00:00,This is Reese. He likes holding hands. 12/10 https://t.co/cbLroGCbmh,Reese,6058,13128,https://pbs.twimg.com/media/CWjQm5gXAAA9GkD.jpg,1,miniature_pinscher,0.822048,1,doberman,0.0960845,1,rottweiler,0.032709300000000004,1,,1.2
1752,677918531514703872,2015-12-18 18:29:07+00:00,"""Everything looks pretty good in there. Make sure to brush your gums. Been flossing? How's school going?"" Both 10/10 https://t.co/lWL2IMJqLR",,389,1291,https://pbs.twimg.com/media/CWhzTbzWUAAEAUN.jpg,1,eskimo_dog,0.199347,1,dalmatian,0.153225,1,american_staffordshire_terrier,0.107798,1,,1.0
1753,677895101218201600,2015-12-18 16:56:01+00:00,Guys this was terrifying. Really spooked me up. We don't rate ghosts. We rate dogs. Please only send dogs... 9/10 https://t.co/EJImi1udYb,,1980,4631,https://pbs.twimg.com/media/CWhd_7WWsAAaqWG.jpg,1,dalmatian,0.550702,1,kuvasz,0.0602264,1,great_pyrenees,0.058631,1,,0.9
1754,677716515794329600,2015-12-18 05:06:23+00:00,IT'S PUPPERGEDDON. Total of 144/120 ...I think https://t.co/ZanVtAtvIq,,939,2935,https://pbs.twimg.com/media/CWe7kw9W4AE8UJh.jpg,1,teddy,0.6629079999999999,0,crib,0.0318912,0,chow,0.0254378,1,,1.2
1755,677700003327029250,2015-12-18 04:00:46+00:00,This is Ralph. He's an interpretive dancer. 10/10 https://t.co/zoDdPyPFsa,Ralph,1387,3262,https://pbs.twimg.com/media/CWesj06W4AAIKl8.jpg,1,siberian_husky,0.120849,1,junco,0.0792056,0,malamute,0.0630875,1,,1.0
1756,677698403548192770,2015-12-18 03:54:25+00:00,This is Sadie. She got her holidays confused. 9/10 damn it Sadie https://t.co/fm7HxOsuPK,Sadie,307,1184,https://pbs.twimg.com/media/CWerGmOXAAAm6NY.jpg,1,shih_tzu,0.916645,1,lhasa,0.057883400000000015,1,pekinese,0.0201258,1,,0.9
1757,677687604918272002,2015-12-18 03:11:30+00:00,This was Cindy's face when she heard Susan forgot the snacks for after the kid's soccer game. 11/10 https://t.co/gzkuVGRgAD,,805,2409,https://pbs.twimg.com/media/CWehRdEWIAAySyO.jpg,1,pembroke,0.573047,1,sunglasses,0.12675799999999998,0,golden_retriever,0.108047,1,,1.1
1758,677673981332312066,2015-12-18 02:17:22+00:00,Endangered triangular pup here. Could be a wizard. Caught mid-laugh. No legs. Just fluff. Probably a wizard. 9/10 https://t.co/GFVIHIod0Z,,1439,3204,https://pbs.twimg.com/media/CWeU5LBWEAA8F0J.jpg,1,maltese_dog,0.817908,1,angora,0.0778051,0,pomeranian,0.0221842,1,,0.9
1759,677662372920729601,2015-12-18 01:31:14+00:00,"In honor of the new Star Wars movie. Here's Yoda pug. 12/10 pet really well, would I https://t.co/pvjdRn00XH",,905,1877,https://pbs.twimg.com/media/CWeKTZTWsAA5R3Z.jpg,1,cowboy_hat,0.25611,0,trench_coat,0.12708599999999998,0,cloak,0.07143889999999999,0,,1.2
1760,677644091929329666,2015-12-18 00:18:36+00:00,This is a dog swinging. I really enjoyed it so I hope you all do as well. 11/10 https://t.co/Ozo9KHTRND,,771,1793,https://pbs.twimg.com/ext_tw_video_thumb/677644010865999872/pu/img/zVHEMYnJKzq1SauT.jpg,1,chihuahua,0.626236,1,italian_greyhound,0.128483,1,swing,0.0598404,0,,1.1
1761,677573743309385728,2015-12-17 19:39:03+00:00,This is Sandy. He's sexually confused. Thinks he's a pigeon. Also an All-American cheese catcher. 10/10 so petable https://t.co/Htu8plSqEu,Sandy,671,2054,https://pbs.twimg.com/media/CWc5uVPXIAErLYr.jpg,2,patio,0.5350699999999999,0,folding_chair,0.0804192,0,parallel_bars,0.034796499999999994,0,,1.0
1762,677565715327688705,2015-12-17 19:07:09+00:00,Contortionist pup here. Inside pentagram. Clearly worships Satan. Known to slowly push fragile stuff off tables 6/10 https://t.co/EX9oR55VMe,,438,1254,https://pbs.twimg.com/media/CWcybBmWcAAigAQ.jpg,1,basset,0.397295,1,welsh_springer_spaniel,0.199554,1,purse,0.105641,0,,0.6
1763,677557565589463040,2015-12-17 18:34:46+00:00,Reckless pupper here. Not even looking at road. Absolute menace. No regard for fellow pupper lives. 10/10 still cute https://t.co/96IBkOYB7j,,1104,2365,https://pbs.twimg.com/media/CWcrAVQWEAA6QMp.jpg,1,seat_belt,0.27725700000000003,0,shih_tzu,0.249017,1,pekinese,0.209213,1,pupper,1.0
1764,677547928504967168,2015-12-17 17:56:29+00:00,Not much to say here. I just think everyone needs to see this. 12/10 https://t.co/AGag0hFHpe,,3509,6671,https://pbs.twimg.com/media/CWciPonWEAUOqLD.jpg,1,american_staffordshire_terrier,0.914978,1,staffordshire_bullterrier,0.08439529999999999,1,boxer,0.000461663,1,,1.2
1765,677530072887205888,2015-12-17 16:45:31+00:00,Say hello to Axel. He's a Black Chevy Pinot on wheels. 0 to 60 in 5.7 seconds (if downhill). 9/10 I call shotgun https://t.co/DKe9DBnnHE,Axel,219,1029,https://pbs.twimg.com/media/CWcSAI-WUAAOB9W.jpg,1,staffordshire_bullterrier,0.6892590000000001,1,norwegian_elkhound,0.026121,1,american_staffordshire_terrier,0.0230747,1,,0.9
1767,677334615166730240,2015-12-17 03:48:51+00:00,This dog gave up mid jump. 9/10 https://t.co/KmMv3Y2zI8,,271,1292,https://pbs.twimg.com/media/CWZgPPUWUAAUOvu.jpg,2,lakeland_terrier,0.859392,1,airedale,0.0672917,1,irish_water_spaniel,0.0495306,1,,0.9
1768,677331501395156992,2015-12-17 03:36:28+00:00,Meet Humphrey. He's a Northern Polyp Viagra. One ear works. Face stuck like that. Always surprised. 9/10 petable af https://t.co/FS7eJQM2F4,Humphrey,225,1047,https://pbs.twimg.com/media/CWZdaGxXAAAjGjb.jpg,1,beagle,0.313464,1,boxer,0.21850300000000006,1,french_bulldog,0.106462,1,,0.9
1769,677328882937298944,2015-12-17 03:26:04+00:00,This is Derek. All the dogs adore Derek. He's a great guy. 10/10 really solid pup https://t.co/KgcsGNb61s,Derek,1437,3509,https://pbs.twimg.com/media/CWZbBlAUsAAjRg5.jpg,1,water_buffalo,0.42425,0,kelpie,0.0290541,1,staffordshire_bullterrier,0.0284697,1,,1.0
1770,677314812125323265,2015-12-17 02:30:09+00:00,"Meet Tassy &amp; Bee. Tassy is pretty chill, but Bee is convinced the Ruffles are haunted. 10/10 &amp; 11/10 respectively https://t.co/fgORpmTN9C",Tassy,512,1583,https://pbs.twimg.com/media/CWZOOIUW4AAQrX_.jpg,2,blenheim_spaniel,0.924127,1,japanese_spaniel,0.0547901,1,chihuahua,0.00820404,1,,1.0
1771,677301033169788928,2015-12-17 01:35:24+00:00,This is Juckson. He's totally on his way to a nascar race. 5/10 for Juckson https://t.co/IoLRvF0Kak,Juckson,386,1181,https://pbs.twimg.com/media/CWZBsjPWsAAZFFl.jpg,1,japanese_spaniel,0.6611779999999999,1,pekinese,0.150119,1,chihuahua,0.11972,1,,0.5
1772,677269281705472000,2015-12-16 23:29:14+00:00,This is the happiest pupper I've ever seen. 10/10 would trade lives with https://t.co/ep8ATEJwRb,,674,1897,https://pbs.twimg.com/media/CWYk0WxWoAAEwRt.jpg,1,shetland_sheepdog,0.656616,1,collie,0.195405,1,german_shepherd,0.0131032,1,pupper,1.0
1773,677228873407442944,2015-12-16 20:48:40+00:00,Say hello to Chuq. He just wants to fit in. 11/10 https://t.co/hGkMCjZzn4,Chuq,1564,3409,https://pbs.twimg.com/media/CWYAEINW4AIuw8P.jpg,1,common_iguana,0.566338,0,tennis_ball,0.154646,0,green_lizard,0.0449758,0,,1.1
1774,677187300187611136,2015-12-16 18:03:28+00:00,Here we see a Byzantine Rigatoni. Very aerodynamic. No eyes. Actually not windy here they just look like that. 9/10 https://t.co/gzI0m6wXRo,,872,2619,https://pbs.twimg.com/media/CWXaQMBWcAAATDi.jpg,1,english_setter,0.282396,1,shih_tzu,0.08411189999999999,1,old_english_sheepdog,0.059538,1,,0.9
1775,676975532580409345,2015-12-16 04:01:59+00:00,This is Cooper. He doesn't know how cheese works. Likes the way it feels on his face. Cheeky tongue slip. 11/10 https://t.co/j1zczS0lI5,Cooper,1020,2651,https://pbs.twimg.com/media/CWUZpydWcAAeipD.jpg,1,malamute,0.363257,1,siberian_husky,0.245862,1,eskimo_dog,0.125547,1,,1.1
1776,676957860086095872,2015-12-16 02:51:45+00:00,10/10 I'd follow this dog into battle no questions asked https://t.co/ngTNXYQF0L,,774,2151,https://pbs.twimg.com/ext_tw_video_thumb/676957802976419840/pu/img/dCj-qlXo73A5hf6Q.jpg,1,labrador_retriever,0.772423,1,beagle,0.055901699999999985,1,golden_retriever,0.0311519,1,,1.0
1777,676949632774234114,2015-12-16 02:19:04+00:00,This is Tyrus. He's a Speckled Centennial Ticonderoga. Terrified of floating red ball. Nifty bandana. 8/10 v petable https://t.co/HqM3YhCaaa,Tyrus,376,1254,https://pbs.twimg.com/media/CWUCGMtWEAAjXnS.jpg,1,welsh_springer_spaniel,0.206479,1,saint_bernard,0.13933900000000002,1,boxer,0.114606,1,,0.8
1778,676948236477857792,2015-12-16 02:13:31+00:00,This is Karl. Karl thinks he's slick. 6/10 sneaky pup https://t.co/Lo4ALwjVh4,Karl,823,2067,https://pbs.twimg.com/media/CWUA1GFW4AAowiq.jpg,1,guenon,0.611603,0,macaque,0.135176,0,squirrel_monkey,0.08324730000000001,0,,0.6
1779,676946864479084545,2015-12-16 02:08:04+00:00,This pups goal was to get all four feet as close to each other as possible. Valiant effort 12/10 https://t.co/2mXALbgBTV,,349,1666,https://pbs.twimg.com/media/CWT_lOQWUAAXPaY.jpg,1,pekinese,0.752707,1,golden_retriever,0.055654599999999985,1,great_pyrenees,0.041017800000000014,1,,1.2
1780,676942428000112642,2015-12-16 01:50:26+00:00,Who leaves the last cupcake just sitting there? 9/10 https://t.co/PWMqAoEx2a,,714,1986,https://pbs.twimg.com/media/CWT7imQXIAMwpQ2.jpg,1,black_footed_ferret,0.707199,0,polecat,0.15463,0,weasel,0.0976255,0,,0.9
1781,676936541936185344,2015-12-16 01:27:03+00:00,Here we see a rare pouched pupper. Ample storage space. Looks alert. Jumps at random. Kicked open that door. 8/10 https://t.co/mqvaxleHRz,,4727,12215,https://pbs.twimg.com/media/CWT2MUgWIAECWig.jpg,1,chesapeake_bay_retriever,0.5452859999999999,1,norwegian_elkhound,0.081482,1,space_heater,0.0473911,0,pupper,0.8
1783,676897532954456065,2015-12-15 22:52:02+00:00,Exotic handheld dog here. Appears unathletic. Feet look deadly. Can be thrown a great distance. 5/10 might pet idk https://t.co/Avq4awulqk,,696,2155,https://pbs.twimg.com/media/CWTSt0UW4AALMNB.jpg,1,hamster,0.628255,0,guinea_pig,0.318646,0,macaque,0.0130582,0,,0.5
1784,676864501615042560,2015-12-15 20:40:47+00:00,Meet Ash. He's just a head now. Lost his body during the Third Crusade. Still in good spirits. 10/10 would pet well https://t.co/NJj2uP0atK,Ash,670,2002,https://pbs.twimg.com/media/CWS0q8iU8AE2Srr.jpg,1,chesapeake_bay_retriever,0.371146,1,water_buffalo,0.0995963,0,weimaraner,0.0489679,1,,1.0
1785,676821958043033607,2015-12-15 17:51:44+00:00,Finally some constructive political change in this country. 11/10 https://t.co/mvQaETHVSb,,14818,21972,https://pbs.twimg.com/media/CWSN-vaXAAA8Ehr.jpg,2,great_pyrenees,0.8698040000000001,1,kuvasz,0.0798143,1,standard_poodle,0.013263,1,,1.1
1786,676819651066732545,2015-12-15 17:42:34+00:00,Watch out Airbud. This pupper is also good at the sports. 12/10 I'm thinking D1 https://t.co/1HrFdo7M0C,,633,1741,https://pbs.twimg.com/media/CWSL4W8WsAAE4KU.jpg,2,rain_barrel,0.625555,0,barrel,0.138383,0,labrador_retriever,0.0394646,1,pupper,1.2
1787,676811746707918848,2015-12-15 17:11:09+00:00,Say hello to Penny &amp; Gizmo. They are practicing their caroling. The ambition in the room is tangible. 9/10 for both https://t.co/aqBHjjh5VD,Penny,407,1370,https://pbs.twimg.com/media/CWSEsO9WwAAX-fZ.jpg,1,chihuahua,0.440916,1,pomeranian,0.345806,1,cocker_spaniel,0.0603312,1,,0.9
1788,676776431406465024,2015-12-15 14:50:49+00:00,"When someone yells ""cops!"" at a party and you gotta get your drunk friend out of there. 10/10 https://t.co/4rMZi5Ca1k",,1935,4791,https://pbs.twimg.com/ext_tw_video_thumb/676776408941662209/pu/img/k-6I3YEZAQtYPBXR.jpg,1,doormat,0.201346,0,dishwasher,0.191749,0,microwave,0.038110000000000005,0,,1.0
1789,676617503762681856,2015-12-15 04:19:18+00:00,I promise this wasn't meant to be a cuteness overload account but ermergerd look at this cozy pupper. 13/10 https://t.co/mpQl2rJjDh,,911,2764,https://pbs.twimg.com/media/CWPUB9TWwAALPPx.jpg,1,chihuahua,0.841084,1,pomeranian,0.12053,1,pekinese,0.00660034,1,pupper,1.3
1790,676613908052996102,2015-12-15 04:05:01+00:00,This is the saddest/sweetest/best picture I've been sent. 12/10 ðŸ˜¢ðŸ¶ https://t.co/vQ2Lw1BLBF,,191,1032,https://pbs.twimg.com/media/CWPQwmJWUAAu_At.jpg,1,book_jacket,0.49379,0,doberman,0.0964228,1,miniature_pinscher,0.07064669999999999,1,,1.2
1791,676606785097199616,2015-12-15 03:36:42+00:00,*screeches for a sec and then faints* 12/10 https://t.co/N5QL4ySBEx,,414,1821,https://pbs.twimg.com/media/CWPKSGpWcAQN6mw.jpg,1,loafer,0.202999,0,doormat,0.200411,0,malinois,0.1423,1,,1.2
1792,676603393314578432,2015-12-15 03:23:14+00:00,This is Godzilla pupper. He had a ruff childhood &amp; now deflects that pain outward by terrorizing cities. Tragic 9/10 https://t.co/g1tLGkyaxr,Godzilla,365,1113,https://pbs.twimg.com/media/CWPHMqKVAAAE78E.jpg,1,whippet,0.8770209999999999,1,great_dane,0.0341819,1,boxer,0.028404,1,pupper,0.9
1795,676588346097852417,2015-12-15 02:23:26+00:00,This is Bubbles. He kinda resembles a fish. Always makes eye contact with u no matter what. Sneaky tongue slip. 5/10 https://t.co/Nrhvc5tLFT,Bubbles,745,2201,https://pbs.twimg.com/media/CWO5gmCUYAAX4WA.jpg,1,boston_bull,0.976577,1,french_bulldog,0.0143237,1,chihuahua,0.00230192,1,,0.5
1796,676582956622721024,2015-12-15 02:02:01+00:00,"Meet Vinnie. He's having fun while being safe. Well not a lot of fun, but definitely safe, and that's important 8/10 https://t.co/vZYtynZZlH",Vinnie,262,1142,https://pbs.twimg.com/media/CWO0m8tUwAAB901.jpg,1,seat_belt,0.790028,0,boston_bull,0.196307,1,french_bulldog,0.0124289,1,,0.8
1797,676575501977128964,2015-12-15 01:32:24+00:00,This pupper is very passionate about Christmas. Wanted to give the tree a hug. So cute. 8/10 https://t.co/NsGyECJuq7,,1064,2467,https://pbs.twimg.com/media/CWOt07EUsAAnOYW.jpg,1,feather_boa,0.424106,0,yorkshire_terrier,0.0731443,1,shetland_sheepdog,0.0575976,1,pupper,0.8
1798,676533798876651520,2015-12-14 22:46:41+00:00,ITSOFLUFFAYYYYY 12/10 https://t.co/bfw13CnuuZ,,522,1804,https://pbs.twimg.com/media/CWOH4s9U8AEtkmQ.jpg,1,chow,0.26527399999999995,1,ice_bear,0.167614,0,fur_coat,0.117506,0,,1.2
1799,676496375194980353,2015-12-14 20:17:59+00:00,Say hello to Griffin. He's upset because his costume for Halloween didn't arrive until today. 9/10 cheer up pup https://t.co/eoBCjSFajX,Griffin,509,1462,https://pbs.twimg.com/media/CWNl3S9WcAARN34.jpg,1,pug,0.985387,1,norwegian_elkhound,0.0044169,1,french_bulldog,0.00389287,1,,0.9
1800,676470639084101634,2015-12-14 18:35:43+00:00,Three generations of pupper. 11/10 for all https://t.co/tAmQYvzrau,,4454,11139,https://pbs.twimg.com/media/CWNOdIpWoAAWid2.jpg,1,golden_retriever,0.7903859999999999,1,borzoi,0.0228851,1,dingo,0.0153434,0,pupper,1.1
1801,676440007570247681,2015-12-14 16:34:00+00:00,Hope your Monday isn't too awful. Here's two baseball puppers. 11/10 for each https://t.co/dB0H9hdZai,,629,1654,https://pbs.twimg.com/media/CWMyl9EWUAAnZJ0.jpg,2,maltese_dog,0.579472,1,toy_poodle,0.133446,1,shih_tzu,0.0943966,1,,1.1
1802,676430933382295552,2015-12-14 15:57:56+00:00,"Meet Duke. He's an Urban Parmesan. They know he's scared of the green rubber dog. ""Why u do dis?"" thinks Duke. 10/10 https://t.co/3bim9U5Idr",Duke,321,1335,https://pbs.twimg.com/media/CWMqV7WUYAEEClG.jpg,1,golden_retriever,0.583875,1,cocker_spaniel,0.203671,1,labrador_retriever,0.0361217,1,,1.0
1803,676263575653122048,2015-12-14 04:52:55+00:00,All this pupper wanted to do was go skiing. No one told him about the El NiÃ±o. Poor pupper. 10/10 maybe next year https://t.co/fTgbq1UBR9,,514,1998,https://pbs.twimg.com/media/CWKSIfUUYAAiOBO.jpg,1,teddy,0.0982826,0,toy_poodle,0.0980293,1,shopping_basket,0.07785210000000001,0,pupper,1.0
1804,676237365392908289,2015-12-14 03:08:46+00:00,Say hello to Winston. He has no respect for the system. Much rebellion. I think that's a palm tree... nice. 8/10 https://t.co/dOLQddhXLZ,Winston,269,1157,https://pbs.twimg.com/media/CWJ6Sc-WwAAlpI6.jpg,1,french_bulldog,0.961996,1,chihuahua,0.021793,1,boston_bull,0.00691629,1,,0.8
1805,676219687039057920,2015-12-14 01:58:31+00:00,This is Kenneth. He's stuck in a bubble. 10/10 hang in there Kenneth https://t.co/uQt37xlYMJ,Kenneth,29535,73262,https://pbs.twimg.com/media/CWJqN9iWwAAg86R.jpg,1,bubble,0.997556,0,leafhopper,0.000158961,0,whippet,0.000132464,1,,1.0
1806,676215927814406144,2015-12-14 01:43:35+00:00,This is Herm. He just wants to be like the other dogs. Sneaky tongue slip. Super fuzzy. 9/10 would cuddle firmly https://t.co/tg8h9lzCHv,Herm,547,1656,https://pbs.twimg.com/media/CWJmzNsWUAE706Z.jpg,1,hamster,0.999484,0,guinea_pig,0.00015821700000000002,0,broccoli,6.0911000000000014e-05,0,,0.9
1807,676191832485810177,2015-12-14 00:07:50+00:00,These two pups just met and have instantly bonded. Spectacular scene. Mesmerizing af. 10/10 and 7/10 for blue dog https://t.co/gwryaJO4tC,,987,2181,https://pbs.twimg.com/media/CWJQ4UmWoAIJ29t.jpg,2,chihuahua,0.376741,1,italian_greyhound,0.17311400000000002,1,muzzle,0.07148510000000001,0,,1.0
1808,676146341966438401,2015-12-13 21:07:04+00:00,This is Bert. He likes flowers. 10/10 https://t.co/lmQRrNxaQu,Bert,632,1837,https://pbs.twimg.com/media/CWIngp5WEAAJOy3.jpg,1,irish_water_spaniel,0.388332,1,standard_poodle,0.284121,1,greenhouse,0.0348681,0,,1.0
1810,676101918813499392,2015-12-13 18:10:33+00:00,Meet Striker. He's ready for Christmas. 11/10 https://t.co/B3xxSLjQSH,Striker,1116,2705,https://pbs.twimg.com/media/CWH_FTgWIAAwOUy.jpg,1,shih_tzu,0.225848,1,norfolk_terrier,0.186873,1,irish_terrier,0.10698699999999997,1,,1.1
1811,676098748976615425,2015-12-13 17:57:57+00:00,Extremely rare pup here. Very religious. Always praying. Too many legs. Not overwhelmingly fluffy. Won't bark. 3/10 https://t.co/REyE5YKVBb,,1344,2856,https://pbs.twimg.com/media/CWH8L72UkAAvjql.jpg,1,walking_stick,0.162179,0,sandal,0.12908599999999998,0,purse,0.0814119,0,,0.3
1812,676089483918516224,2015-12-13 17:21:08+00:00,"""Yes hello I'ma just snag this here toasted bagel real quick. carry on."" 9/10 https://t.co/Cuz0Osnekp",,416,1255,https://pbs.twimg.com/media/CWHzzFGXIAA0Y_H.jpg,1,bull_mastiff,0.743808,1,boxer,0.106697,1,american_staffordshire_terrier,0.0423353,1,,0.9
1813,675898130735476737,2015-12-13 04:40:46+00:00,I'm sure you've all seen this pupper. Not prepared at all for the flying disc of terror. 10/10 https://t.co/G0pQiFGM7O,,540,1536,https://pbs.twimg.com/media/CWFFt3_XIAArIYK.jpg,1,labrador_retriever,0.40743,1,malinois,0.0770367,1,pug,0.0745973,1,pupper,1.0
1814,675891555769696257,2015-12-13 04:14:39+00:00,This is Donny. He's summoning the demon monster Babadook. 6/10 Donny please no that won't be a good time for anyone https://t.co/kiW6Knb7Gp,Donny,814,2030,https://pbs.twimg.com/media/CWE_x33UwAEE3no.jpg,1,italian_greyhound,0.305637,1,whippet,0.232057,1,great_dane,0.117806,1,,0.6
1815,675888385639251968,2015-12-13 04:02:03+00:00,Breathtaking scene. A father taking care of his newborn pup. Tugs at the heartstrings. 10/10 restores my faith https://t.co/06oZdehGEa,,908,2268,https://pbs.twimg.com/media/CWE85snWIAEG5ES.jpg,1,west_highland_white_terrier,0.672117,1,old_english_sheepdog,0.146147,1,komondor,0.023141400000000003,1,,1.0
1816,675878199931371520,2015-12-13 03:21:34+00:00,"Ok, I'll admit this is a pretty adorable bunny hopping towards the ocean but please only send in dogs... 11/10 https://t.co/sfsVCGIipI",,1331,3981,https://pbs.twimg.com/media/CWEzo19WoAEiOCj.jpg,1,wood_rabbit,0.785756,0,hare,0.118181,0,cardigan,0.0436271,1,,1.1
1817,675870721063669760,2015-12-13 02:51:51+00:00,&amp; this is Yoshi. Another world record contender 11/10 (what the hell is happening why are there so many contenders?) https://t.co/QG708dDNH6,,535,1558,https://pbs.twimg.com/media/CWEs1b-WEAEhq82.jpg,1,golden_retriever,0.263892,1,welsh_springer_spaniel,0.184193,1,beagle,0.182241,1,,1.1
1818,675853064436391936,2015-12-13 01:41:41+00:00,Here we have an entire platoon of puppers. Total score: 88/80 would pet all at once https://t.co/y93p6FLvVw,,1219,2571,https://pbs.twimg.com/media/CWEcxqWVEAAHyGH.jpg,1,labrador_retriever,0.868367,1,golden_retriever,0.0433046,1,vizsla,0.0282072,1,,1.1
1820,675845657354215424,2015-12-13 01:12:15+00:00,"This is Pepper. She's not fully comfortable riding her imaginary bike yet. 10/10 don't worry pupper, it gets easier https://t.co/40dj4eTsXG",Pepper,830,2162,https://pbs.twimg.com/media/CWEWClfW4AAnqhG.jpg,1,pug,0.8839520000000001,1,boston_bull,0.0110568,1,french_bulldog,0.00983981,1,pupper,1.0
1821,675822767435051008,2015-12-12 23:41:18+00:00,ðŸŽ¶ HELLO FROM THE OTHER SIIIIIIIIDE ðŸŽ¶ 10/10s https://t.co/GK2HJtkdQk,,511,1449,https://pbs.twimg.com/media/CWEBOFYWwAA-O2c.jpg,1,pomeranian,0.4607100000000001,1,chow,0.202765,1,pekinese,0.133266,1,,1.0
1822,675820929667219457,2015-12-12 23:34:00+00:00,Here's a handful of sleepy puppers. All look unaware of their surroundings. Lousy guard dogs. Still cute tho 11/10s https://t.co/lyXX3v5j4s,,225,1000,https://pbs.twimg.com/media/CWD_jQMWEAAdYwH.jpg,1,basset,0.556373,1,beagle,0.201675,1,bloodhound,0.110848,1,,1.1
1823,675798442703122432,2015-12-12 22:04:39+00:00,This is Bernie. He just touched a boob for the first time. 10/10 https://t.co/whQKMygnK6,Bernie,3256,9783,https://pbs.twimg.com/media/CWDrGH4UYAARoq_.jpg,1,beagle,0.681218,1,basset,0.125121,1,boxer,0.0803982,1,,1.0
1824,675781562965868544,2015-12-12 20:57:34+00:00,Say hello to Buddah. He was Waldo for Halloween. 11/10 https://t.co/DVAqAnb624,Buddah,446,1543,https://pbs.twimg.com/media/CWDbv2yU4AARfeH.jpg,1,maltese_dog,0.921968,1,west_highland_white_terrier,0.0178107,1,toy_poodle,0.0135554,1,,1.1
1825,675740360753160193,2015-12-12 18:13:51+00:00,Here's a pupper licking in slow motion. 12/10 please enjoy https://t.co/AUJi8ujxw9,,326,1112,https://pbs.twimg.com/ext_tw_video_thumb/675740268751138818/pu/img/dVaVeFAVT-lk_1ZV.jpg,1,golden_retriever,0.800495,1,kuvasz,0.0977564,1,saluki,0.0684146,1,pupper,1.2
1826,675710890956750848,2015-12-12 16:16:45+00:00,This is Lenny. He was just told that he couldn't explore the fish tank. 12/10 smh all that work for nothing https://t.co/JWi6YrpiO1,Lenny,772,1791,https://pbs.twimg.com/media/CWCbd8ZWoAAtqoH.jpg,2,standard_schnauzer,0.4414270000000001,1,miniature_schnauzer,0.248885,1,sealyham_terrier,0.164967,1,,1.2
1827,675707330206547968,2015-12-12 16:02:36+00:00,We've got ourselves a battle here. Watch out Reggie. 11/10 https://t.co/ALJvbtcwf0,,644,1883,https://pbs.twimg.com/media/CWCYOqWUAAARmGr.jpg,1,bath_towel,0.721933,0,staffordshire_bullterrier,0.0593442,1,bagel,0.035701599999999986,0,,1.1
1828,675706639471788032,2015-12-12 15:59:51+00:00,This is a Sizzlin Menorah spaniel from Brooklyn named Wylie. Lovable eyes. Chiller as hell. 10/10 and I'm out.. poof https://t.co/7E0AiJXPmI,,90,614,https://pbs.twimg.com/media/CWCXj35VEAIFvtk.jpg,1,english_springer,0.9903,1,welsh_springer_spaniel,0.00207991,1,cocker_spaniel,0.00201378,1,,1.0
1829,675534494439489536,2015-12-12 04:35:48+00:00,Seriously guys?! Only send in dogs. I only rate dogs. This is a baby black bear... 11/10 https://t.co/H7kpabTfLj,,389,1753,https://pbs.twimg.com/media/CV_7CV6XIAEV05u.jpg,1,chow,0.749368,1,schipperke,0.13373800000000002,1,newfoundland,0.0499138,1,,1.1
1830,675531475945709568,2015-12-12 04:23:49+00:00,This is Ellie AKA Queen Slayer of the Orbs. Very self-motivated. Great yard. Rad foliage. 10/10 would pet diligently https://t.co/c9jmg3Xtzn,Ellie,361,1122,https://pbs.twimg.com/media/CV_4ShmUYAA3wNu.jpg,1,pembroke,0.918441,1,cardigan,0.0273395,1,siberian_husky,0.020221,1,,1.0
1831,675522403582218240,2015-12-12 03:47:46+00:00,Meet Sammy. He's a Motorola Firefox. Hat under hoodie (must be a half-decent up and coming white rapper) 10/10 https://t.co/rO2zxf0OQ0,Sammy,273,988,https://pbs.twimg.com/media/CV_wCh8W4AEWWZ9.jpg,1,cocker_spaniel,0.299708,1,golden_retriever,0.263665,1,irish_setter,0.0803233,1,,1.0
1832,675517828909424640,2015-12-12 03:29:35+00:00,12/10 stay woke https://t.co/XDiQw4Akiw,,440,1229,https://pbs.twimg.com/media/CV_r3v4VAAALvwg.jpg,1,scottish_deerhound,0.240591,1,groenendael,0.156916,1,flat_coated_retriever,0.0908994,1,,1.2
1833,675501075957489664,2015-12-12 02:23:01+00:00,"I shall call him squishy and he shall be mine, and he shall be my squishy. 13/10 https://t.co/WId5lxNdPH",,5541,16362,https://pbs.twimg.com/media/CV_cnjHWUAADc-c.jpg,1,dough,0.806757,0,bakery,0.0279066,0,french_loaf,0.0181889,0,,1.3
1834,675497103322386432,2015-12-12 02:07:14+00:00,Meet Reggie. He's going for the world record. Must concentrate. Focus up pup. 11/10 we all believe in you Reggie https://t.co/h3AWz4AzuC,Reggie,1220,2995,https://pbs.twimg.com/media/CV_ZAhcUkAUeKtZ.jpg,1,vizsla,0.5195890000000001,1,miniature_pinscher,0.0647712,1,rhodesian_ridgeback,0.0614913,1,,1.1
1835,675489971617296384,2015-12-12 01:38:53+00:00,RT until we find this dog. Clearly a cool dog (front leg relaxed out window). Looks to be a superb driver. 10/10 https://t.co/MnTrKaQ8Wn,,564,1230,https://pbs.twimg.com/media/CV_SimUWoAAvJSY.jpg,1,west_highland_white_terrier,0.139613,1,seat_belt,0.118647,0,old_english_sheepdog,0.0939522,1,,1.0
1836,675483430902214656,2015-12-12 01:12:54+00:00,Rare shielded battle dog here. Very happy about abundance of lettuce. Painfully slow fetcher. Still petable. 5/10 https://t.co/C3tlKVq7eO,,925,1758,https://pbs.twimg.com/media/CV_MmGZU8AAggM6.jpg,1,box_turtle,0.543706,0,terrapin,0.2026,0,loggerhead,0.0711215,0,,0.5
1837,675432746517426176,2015-12-11 21:51:30+00:00,Happy Friday. Here's some golden puppers. 12/10 for all https://t.co/wNkqAED6lG,,542,1449,https://pbs.twimg.com/media/CV-ef64WoAAbh0I.jpg,1,labrador_retriever,0.986548,1,golden_retriever,0.00886185,1,chihuahua,0.000693528,1,,1.2
1838,675372240448454658,2015-12-11 17:51:04+00:00,"The tail alone is 13/10. Great dog, better owner https://t.co/IyAXinfyju",,491,1607,https://pbs.twimg.com/media/CV9nd30XAAAEba5.jpg,1,chihuahua,0.4163850000000001,1,west_highland_white_terrier,0.102933,1,samoyed,0.0872995,1,,1.3
